year,line,naic_code,company_name,premium,complaints,complaint_index,source_file
2018,health,79413,UnitedHealthcare Ins Co,1947993830.0,37,0.41,2018_health.pdf
2018,health,97179,UnitedHealthcare Life Ins Co,836896.0,1,,2018_health.pdf
2018,health,62235,Unum Life Ins Co Of Amer,45368379.0,2,0.94,2018_health.pdf
2018,health,39616,Vision Serv Plan Ins Co,34340585.0,1,0.62,2018_health.pdf
2018,health,65900,Wilco Life Ins Co,58295.0,1,,2018_health.pdf
2018,homeowners,19240,Allstate Ind Co,3863904.0,2,11.54,2018_homeowners.pdf
2018,homeowners,19232,Allstate Ins Co,34740767.0,2,1.28,2018_homeowners.pdf
2018,homeowners,17230,Allstate Prop & Cas Ins Co,35920941.0,1,0.62,2018_homeowners.pdf
2018,homeowners,37907,Allstate Vehicle & Prop Ins Co,80002996.0,8,2.23,2018_homeowners.pdf
2018,homeowners,10111,American Bankers Ins Co Of FL,6362268.0,4,14.02,2018_homeowners.pdf
2018,homeowners,23450,American Family Home Ins Co,1673650.0,1,13.32,2018_homeowners.pdf
2018,homeowners,10386,American Family Ins Co,19157522.0,1,1.16,2018_homeowners.pdf
2018,homeowners,19275,American Family Mut Ins Co SI,71679226.0,3,0.93,2018_homeowners.pdf
2018,homeowners,19704,American States Ins Co,,1,,2018_homeowners.pdf
2018,homeowners,18988,Auto Owners Ins Co,554023.0,1,,2018_homeowners.pdf
2018,homeowners,15512,Automobile Club Inter-Insurance Exchang,3053394.0,1,7.3,2018_homeowners.pdf
2018,homeowners,18767,Church Mutual Insurance Company,613213.0,1,,2018_homeowners.pdf
2018,homeowners,29734,Conifer Ins Co,1692761.0,2,26.34,2018_homeowners.pdf
2018,homeowners,22640,Consolidated Ins Co,51665012.0,4,1.73,2018_homeowners.pdf
2018,homeowners,26263,Erie Ins Co,76178353.0,2,0.59,2018_homeowners.pdf
2018,homeowners,26271,Erie Ins Exch,35177130.0,1,0.63,2018_homeowners.pdf
2018,homeowners,25712,Esurance Ins Co,3318415.0,1,6.72,2018_homeowners.pdf
2018,homeowners,21652,Farmers Insurance Exchange,414774.0,2,,2018_homeowners.pdf
2018,homeowners,11185,Foremost Ins Co Grand Rapids MI,10619167.0,1,2.1,2018_homeowners.pdf
2018,homeowners,17221,Homesite Ins Co,24460944.0,1,0.91,2018_homeowners.pdf
2018,homeowners,13927,Homesite Ins Co Of The Midwest,12738570.0,2,3.5,2018_homeowners.pdf
2018,homeowners,22756,Horace Mann Prop & Cas Ins Co,296621.0,1,,2018_homeowners.pdf
2018,homeowners,22624,Indiana Farmers Mut Ins Co,51145458.0,1,0.44,2018_homeowners.pdf
2018,homeowners,33600,LM Ins Corp,9249181.0,1,2.41,2018_homeowners.pdf
2018,homeowners,26298,Metropolitan Prop & Cas Ins Co,11054026.0,1,2.02,2018_homeowners.pdf
2018,homeowners,26093,Nationwide Affinity Co of Amer,12624829.0,1,1.77,2018_homeowners.pdf
2018,homeowners,23760,Nationwide Gen Ins Co,2340496.0,1,9.53,2018_homeowners.pdf
2018,homeowners,23779,Nationwide Mut Fire Ins Co,12436709.0,1,1.79,2018_homeowners.pdf
2018,homeowners,13714,Pharmacists Mut Ins Co,195095.0,1,,2018_homeowners.pdf
2018,homeowners,18058,Philadephia Indemnity Ins Co,6720903.0,1,3.32,2018_homeowners.pdf
2018,homeowners,44695,Progressive Paloverde Ins Co,277311157.0,1,0.08,2018_homeowners.pdf
2018,homeowners,38784,Progressive Southeastern Ins Co,7820442.0,2,5.7,2018_homeowners.pdf
2018,homeowners,34690,Property & Cas Ins Co Of Hartford,6530710.0,1,3.41,2018_homeowners.pdf
2018,homeowners,32905,Property Owners Ins Co,83067146.0,4,1.07,2018_homeowners.pdf
2018,homeowners,11215,Safeco Ins Co Of IN,89364246.0,1,0.25,2018_homeowners.pdf
2018,homeowners,19259,Selective Ins Co Of SC,9901077.0,1,2.25,2018_homeowners.pdf
2018,homeowners,23388,Shelter Mut Ins Co,12640337.0,1,1.76,2018_homeowners.pdf
2018,homeowners,42986,Standard Guar Ins Co,12470.0,3,,2018_homeowners.pdf
2018,homeowners,25143,State Farm Fire & Cas Co,502702497.0,18,0.8,2018_homeowners.pdf
2018,homeowners,28188,Travco Ins Co,46920906.0,2,0.95,2018_homeowners.pdf
2018,homeowners,27998,Travelers Home & Marine Ins Co,1981673.0,1,11.25,2018_homeowners.pdf
2018,homeowners,15288,United Farm Family Mut Ins Co,154959656.0,3,0.43,2018_homeowners.pdf
2018,homeowners,10861,Universal Prop & Cas Ins,13328393.0,8,13.38,2018_homeowners.pdf
2018,homeowners,26131,Western Reserve Mut Cas Co,7144259.0,1,3.12,2018_homeowners.pdf
2018,homeowners,24112,Westfield Ins Co,2316770.0,1,9.62,2018_homeowners.pdf
2018,homeowners,15407,Wolverine Mut Ins Co,2987941.0,1,7.46,2018_homeowners.pdf
2018,life,77879,5 Star Life Ins Co,2500009.0,1,10.44,2018_life.pdf
2018,life,71854,AAA Life Ins Co,7616065.0,1,3.43,2018_life.pdf
2018,life,62200,Accordia Life & Ann Co,11854799.0,10,22.01,2018_life.pdf
2018,life,90611,Allianz Life Ins Co Of N Amer,10911286.0,1,2.39,2018_life.pdf
2018,life,70866,Allstate Assur Co,3466087.0,1,7.53,2018_life.pdf
2018,life,60186,Allstate Life Ins Co,8272820.0,2,6.31,2018_life.pdf
2018,life,60399,American Family Life Ins Co,19922723.0,2,2.62,2018_life.pdf
2018,life,60488,American Gen Life Ins Co,37017595.0,7,4.93,2018_life.pdf
2018,life,60534,American Heritage Life Ins Co,3221293.0,1,8.1,2018_life.pdf
2018,life,60836,American Republic Ins Co,379312.0,1,68.79,2018_life.pdf
2018,life,60895,American United Life Ins Co,52944781.0,2,0.99,2018_life.pdf
2018,life,61069,Anthem Life Ins Co,23616080.0,1,1.1,2018_life.pdf
2018,life,61689,Athene Ann & Life Co,2817726.0,9,83.35,2018_life.pdf
2018,life,61093,Atlanta Life Ins Co,22170.0,1,1177.02,2018_life.pdf
2018,life,61263,Bankers Life & Cas Co,19628465.0,4,5.32,2018_life.pdf
2018,life,87726,Brighthouse Life Ins Co,26325018.0,1,0.99,2018_life.pdf
2018,life,62626,CMFG Life Ins Co,16712878.0,1,1.56,2018_life.pdf
2018,life,61832,Chesapeake Life Ins Co,776958.0,1,33.59,2018_life.pdf
2018,life,62049,Colonial Life & Accident Ins Co,4326368.0,1,6.03,2018_life.pdf
2018,life,62065,Colonial Penn Life Ins Co,6339598.0,1,4.12,2018_life.pdf
2018,life,62359,Constitution Life Ins Co,246737.0,1,105.76,2018_life.pdf
2018,life,71129,Dearborn Natl Life Ins Co,2500850.0,1,10.43,2018_life.pdf
2018,life,63177,Farmers New World Life Ins Co,8822151.0,1,2.96,2018_life.pdf
2018,life,63274,Fidelity & Guar Life Ins Co,3436015.0,1,7.59,2018_life.pdf
2018,life,91642,Forethought Life Ins Co,7416677.0,4,14.07,2018_life.pdf
2018,life,65536,Genworth Life & Ann Ins Co,16176516.0,1,1.61,2018_life.pdf
2018,life,91472,Globe Life & Accident Ins Co,19871170.0,4,5.25,2018_life.pdf
2018,life,64513,Horace Mann Life Ins Co,2305351.0,1,11.32,2018_life.pdf
2018,life,65056,Jackson Natl Life Ins Co,13981402.0,1,1.87,2018_life.pdf
2018,life,65595,Lincoln Benefit Life Co,17326718.0,1,1.51,2018_life.pdf
2018,life,65676,Lincoln Natl Life Ins Co,121857664.0,4,0.86,2018_life.pdf
2018,life,73504,Lumico Life Ins Co,429387.0,1,60.77,2018_life.pdf
2018,life,65935,Massachusetts Mut Life Ins Co,96417846.0,1,0.27,2018_life.pdf
2018,life,65978,Metropolitan Life Ins Co,158916161.0,6,0.99,2018_life.pdf
2018,life,66044,Midland Natl Life Ins Co,30711580.0,2,1.7,2018_life.pdf
2018,life,66869,Nationwide Life Ins Co,258662714.0,1,0.1,2018_life.pdf
2018,life,66915,New York Life Ins Co,68736790.0,3,1.14,2018_life.pdf
2018,life,67091,Northwestern Mut Life Ins Co,231563254.0,1,0.11,2018_life.pdf
2018,life,67539,Pan Amer Life Ins Co,52144.0,1,500.43,2018_life.pdf
2018,life,72125,Physicians Life Ins Co,6194647.0,2,8.42,2018_life.pdf
2018,life,65919,Primerica Life Ins Co,28688795.0,2,1.82,2018_life.pdf
2018,life,79227,Pruco Life Ins Co,71283297.0,1,0.37,2018_life.pdf
2018,life,60183,S USA Life Ins Co Inc,266176.0,2,196.07,2018_life.pdf
2018,life,78662,Senior Life Ins Co,542533.0,1,48.1,2018_life.pdf
2018,life,69108,State Farm Life Ins Co,112510064.0,2,0.46,2018_life.pdf
2018,life,60142,TIAA Cref Life Ins Co,7347358.0,1,3.55,2018_life.pdf
2018,life,69396,Texas Life Ins Co,9053655.0,1,2.88,2018_life.pdf
2018,life,86231,Transamerica Life Ins Co,37611581.0,3,2.08,2018_life.pdf
2018,life,66281,Transamerica Premier Life Ins Co,29294336.0,6,5.34,2018_life.pdf
2018,life,80802,US Br Sun Life Assur Co of Canada,19609870.0,1,1.33,2018_life.pdf
2018,life,84530,US Financial Life Ins Co,2085973.0,2,25.02,2018_life.pdf
2018,life,69892,United Farm Family Life Ins Co,105689700.0,1,0.25,2018_life.pdf
2018,life,69922,United Home Life Ins Co,1603926.0,2,32.54,2018_life.pdf
2018,life,69930,United Ins Co Of Amer,2446978.0,1,10.66,2018_life.pdf
2018,life,69868,United Of Omaha Life Ins Co,45266536.0,1,0.58,2018_life.pdf
2018,life,62235,Unum Life Ins Co Of Amer,20367935.0,1,1.28,2018_life.pdf
2018,life,80942,Voya Ins & Ann Co,478940.0,1,54.48,2018_life.pdf
2018,life,70319,Washington Natl Ins Co,988571.0,1,26.4,2018_life.pdf
2018,life,70483,Western & Southern Life Ins Co,13732529.0,2,3.8,2018_life.pdf
2018,life,65900,Wilco Life Ins Co,2345076.0,1,11.13,2018_life.pdf
2019,annuity,60488,American Gen Life Ins Co,250109408.0,2,4.03,2019_annuity.pdf
2019,annuity,60895,American United Life Ins Co,268822193.0,2,3.75,2019_annuity.pdf
2019,annuity,65056,Jackson Natl Life Ins Co,394110642.0,1,1.28,2019_annuity.pdf
2019,annuity,65935,Massachusetts Mut Life Ins Co,68674275.0,1,7.33,2019_annuity.pdf
2019,annuity,78077,Mony Life Ins Co Of Amer,14600.0,1,,2019_annuity.pdf
2019,annuity,57568,National Catholic Soc Of Foresters,387286.0,1,,2019_annuity.pdf
2019,annuity,67091,Northwestern Mut Life Ins Co,72702602.0,1,6.92,2019_annuity.pdf
2019,annuity,69108,State Farm Life Ins Co,11382219.0,1,44.23,2019_annuity.pdf
2019,annuity,69345,Teachers Ins & Ann Assoc Of Amer,222680265.0,1,2.26,2019_annuity.pdf
2019,annuity,86231,Transamerica Life Ins Co,74873410.0,1,6.72,2019_annuity.pdf
2019,auto,22667,Ace Amer Ins Co,12432103.0,1,1.11,2019_auto.pdf
2019,auto,14184,Acuity A Mut Ins Co,37105963.0,1,0.37,2019_auto.pdf
2019,auto,19240,Allstate Ind Co,10731694.0,3,3.85,2019_auto.pdf
2019,auto,19232,Allstate Ins Co,21913585.0,1,0.63,2019_auto.pdf
2019,auto,17230,Allstate Prop & Cas Ins Co,268660183.0,17,0.87,2019_auto.pdf
2019,auto,10730,American Access Cas Co,20637537.0,12,8.0,2019_auto.pdf
2019,auto,10386,American Family Ins Co,73507454.0,4,0.75,2019_auto.pdf
2019,auto,19275,American Family Mut Ins Co SI,82713231.0,2,0.33,2019_auto.pdf
2019,auto,10864,American Freedom Ins Co,9532900.0,7,10.1,2019_auto.pdf
2019,auto,43494,American Hallmark Ins Co Of TX,9358655.0,2,2.94,2019_auto.pdf
2019,auto,28401,American Natl Prop & Cas Co,6510596.0,2,4.23,2019_auto.pdf
2019,auto,19992,American Select Ins Co,23710839.0,1,0.58,2019_auto.pdf
2019,auto,19283,American Standard Ins Co of WI,3086148.0,1,4.46,2019_auto.pdf
2019,auto,11558,AssuranceAmerica Ins Co,6314076.0,3,6.54,2019_auto.pdf
2019,auto,18988,Auto Owners Ins Co,144952656.0,6,0.57,2019_auto.pdf
2019,auto,19658,Bristol W Ins Co,16429536.0,2,1.67,2019_auto.pdf
2019,auto,37770,CSAA Gen Ins Co,15624033.0,1,0.88,2019_auto.pdf
2019,auto,25615,Charter Oak Fire Ins Co,3503962.0,1,3.93,2019_auto.pdf
2019,auto,22640,Consolidated Ins Co,64349899.0,5,1.07,2019_auto.pdf
2019,auto,42587,Depositors Ins Co,37789121.0,2,0.73,2019_auto.pdf
2019,auto,13688,Elephant Ins Co,10076992.0,8,10.92,2019_auto.pdf
2019,auto,15130,Encompass Ind Co,5459249.0,2,5.04,2019_auto.pdf
2019,auto,26271,Erie Ins Exch,184064622.0,10,0.75,2019_auto.pdf
2019,auto,25712,Esurance Ins Co,19642754.0,2,1.4,2019_auto.pdf
2019,auto,10120,Everest Natl Ins Co,1135763.0,1,12.11,2019_auto.pdf
2019,auto,14254,Falcon Ins Co,1395595.0,4,39.43,2019_auto.pdf
2019,auto,10336,First Acceptance Ins Co Inc,7378249.0,6,11.19,2019_auto.pdf
2019,auto,13587,First Chicago Ins Co,30420965.0,11,4.97,2019_auto.pdf
2019,auto,11185,Foremost Ins Co Grand Rapids MI,3023424.0,1,4.55,2019_auto.pdf
2019,auto,14249,Founders Ins Co,17503913.0,10,7.86,2019_auto.pdf
2019,auto,14138,GEICO Advantage Ins Co,67731969.0,4,0.81,2019_auto.pdf
2019,auto,14139,GEICO Choice Ins Co,53714123.0,1,0.26,2019_auto.pdf
2019,auto,14137,GEICO Secure Ins Co,40390869.0,6,2.04,2019_auto.pdf
2019,auto,21253,Garrison Prop & Cas Ins Co,13244742.0,5,5.19,2019_auto.pdf
2019,auto,41491,Geico Cas Co,67701482.0,4,0.81,2019_auto.pdf
2019,auto,35882,Geico Gen Ins Co,24832959.0,5,2.77,2019_auto.pdf
2019,auto,22055,Geico Ind Co,15218802.0,2,1.81,2019_auto.pdf
2019,auto,22063,Government Employees Ins Co,8472706.0,1,1.62,2019_auto.pdf
2019,auto,11371,Great West Cas Co,21300570.0,1,0.65,2019_auto.pdf
2019,auto,29424,Hartford Cas Ins Co,742054.0,1,,2019_auto.pdf
2019,auto,14176,Hastings Mut Ins Co,23373144.0,1,0.59,2019_auto.pdf
2019,auto,25054,Hudson Ins Co,1233457.0,1,11.15,2019_auto.pdf
2019,auto,22624,Indiana Farmers Mut Ins Co,101856439.0,1,0.14,2019_auto.pdf
2019,auto,22659,Indiana Ins Co,1411955.0,1,9.74,2019_auto.pdf
2019,auto,36447,LM Gen Ins Co,,1,,2019_auto.pdf
2019,auto,33600,LM Ins Corp,2582595.0,1,5.33,2019_auto.pdf
2019,auto,11198,Loya Ins Co,1262860.0,1,10.89,2019_auto.pdf
2019,auto,21229,Memberselect Ins Co,7758172.0,1,1.77,2019_auto.pdf
2019,auto,34339,Metropolitan Grp Prop & Cas Ins Co,16563247.0,1,0.83,2019_auto.pdf
2019,auto,26298,Metropolitan Prop & Cas Ins Co,11085364.0,2,2.48,2019_auto.pdf
2019,auto,41653,Milbank Ins Co,5465598.0,1,2.52,2019_auto.pdf
2019,auto,14621,Motorists Mut Ins Co,10514154.0,1,1.31,2019_auto.pdf
2019,auto,11991,National Cas Co,6103206.0,1,2.25,2019_auto.pdf
2019,auto,42447,National Gen Assur Co,4325563.0,2,6.36,2019_auto.pdf
2019,auto,23760,Nationwide Gen Ins Co,69441.0,1,,2019_auto.pdf
2019,auto,23787,Nationwide Mut Ins Co,25362915.0,2,1.08,2019_auto.pdf
2019,auto,24082,Ohio Security Ins Co,12716077.0,2,2.16,2019_auto.pdf
2019,auto,24147,Old Republic Ins Co,6629017.0,1,2.08,2019_auto.pdf
2019,auto,39098,Omni Ins Co,980290.0,3,,2019_auto.pdf
2019,auto,24228,Pekin Ins Co,8416360.0,1,1.63,2019_auto.pdf
2019,auto,37648,Permanent Gen Assur Corp,21461481.0,9,5.77,2019_auto.pdf
2019,auto,44695,Progressive Paloverde Ins Co,300473935.0,20,0.92,2019_auto.pdf
2019,auto,38784,Progressive Southeastern Ins Co,294566997.0,14,0.65,2019_auto.pdf
2019,auto,12416,Protective Ins Co,2461993.0,1,5.59,2019_auto.pdf
2019,auto,34509,Rider Ins Co,696496.0,1,,2019_auto.pdf
2019,auto,10974,Root Ins Co,12968381.0,4,4.24,2019_auto.pdf
2019,auto,25405,Safe Auto Ins Co,38059411.0,9,3.25,2019_auto.pdf
2019,auto,11215,Safeco Ins Co Of IN,130906371.0,7,0.74,2019_auto.pdf
2019,auto,12572,Selective Ins Co Of Amer,8506111.0,1,1.62,2019_auto.pdf
2019,auto,19259,Selective Ins Co Of SC,16778507.0,1,0.82,2019_auto.pdf
2019,auto,15261,Society Ins a Mut Co,1916866.0,1,7.18,2019_auto.pdf
2019,auto,10271,Sonnenberg Mut Ins Assoc,10781608.0,1,1.28,2019_auto.pdf
2019,auto,19070,Standard Fire Ins Co,52864757.0,4,1.04,2019_auto.pdf
2019,auto,25127,State Auto Prop & Cas Ins Co,10199622.0,1,1.35,2019_auto.pdf
2019,auto,25143,State Farm Fire & Cas Co,44126467.0,4,1.25,2019_auto.pdf
2019,auto,25178,State Farm Mut Auto Ins Co,796358749.0,45,0.78,2019_auto.pdf
2019,auto,28188,Travco Ins Co,10012022.0,2,2.75,2019_auto.pdf
2019,auto,25658,Travelers Ind Co,8823271.0,1,1.56,2019_auto.pdf
2019,auto,12188,Trexis Ins Corp,14989579.0,4,3.67,2019_auto.pdf
2019,auto,27120,Trumbull Ins Co,19196238.0,4,2.87,2019_auto.pdf
2019,auto,40118,Trustgard Ins Co,28221297.0,1,0.49,2019_auto.pdf
2019,auto,25968,USAA Cas Ins Co,30570917.0,2,0.9,2019_auto.pdf
2019,auto,18600,USAA Gen Ind Co,31729005.0,2,0.87,2019_auto.pdf
2019,auto,10655,Unique Ins Co,504217.0,1,,2019_auto.pdf
2019,auto,15288,United Farm Family Mut Ins Co,307412391.0,14,0.63,2019_auto.pdf
2019,auto,14941,Viva Seguros Ins co,3085027.0,7,31.21,2019_auto.pdf
2019,auto,27090,Young Amer Ins Co,1532521.0,2,17.95,2019_auto.pdf
2019,auto,16535,Zurich Amer Ins Co,21595827.0,2,1.27,2019_auto.pdf
2019,health,60054,Aetna Life Ins Co,698564415.0,9,0.38,2019_health.pdf
2019,health,60380,American Family Life Assur Co of Col,96281640.0,4,1.24,2019_health.pdf
2019,health,19275,American Family Mut Ins Co SI,1090872.0,1,27.28,2019_health.pdf
2019,health,69337,American Fin Security Life Ins Co,66912.0,1,,2019_health.pdf
2019,health,60534,American Heritage Life Ins Co,19110054.0,1,1.56,2019_health.pdf
2019,health,80624,American Progressive L&H Ins Of NY,5799.0,1,,2019_health.pdf
2019,health,88366,American Retirement Life Ins Co,17953329.0,2,3.31,2019_health.pdf
2019,health,61301,Ameritas Life Ins Corp,15333729.0,1,1.94,2019_health.pdf
2019,health,28207,Anthem Ins Co Inc,1776177862.0,71,1.19,2019_health.pdf
2019,health,61263,Bankers Life & Cas Co,25542119.0,3,3.5,2019_health.pdf
2019,health,10142,CareSource IN,274422881.0,67,7.27,2019_health.pdf
2019,health,67369,Cigna Hlth & Life Ins Co,191239322.0,2,0.31,2019_health.pdf
2019,health,62065,Colonial Penn Life Ins Co,23245706.0,1,1.28,2019_health.pdf
2019,health,62308,Connecticut Gen Life Ins Co,63645.0,1,,2019_health.pdf
2019,health,71730,Continental Amer Ins Co,17150603.0,2,3.47,2019_health.pdf
2019,health,20443,Continental Cas Co,8290138.0,1,3.59,2019_health.pdf
2019,health,68500,Continental Life Ins Co Brentwood,51415040.0,2,1.16,2019_health.pdf
2019,health,52634,Delta Dental Plan of IN Inc,88714175.0,1,0.34,2019_health.pdf
2019,health,20281,Federal Ins Co,3642441.0,2,16.34,2019_health.pdf
2019,health,11221,First Commonwealth Ltd Hlth Serv Cor,229429.0,1,,2019_health.pdf
2019,health,64696,First Continental Life & Acc,243734.0,1,,2019_health.pdf
2019,health,70025,Genworth Life Ins Co,46512992.0,2,1.28,2019_health.pdf
2019,health,62286,Golden Rule Ins Co,52118911.0,3,1.71,2019_health.pdf
2019,health,64246,Guardian Life Ins Co Of Amer,66126698.0,3,1.35,2019_health.pdf
2019,health,70815,Hartford Life & Accident Ins Co,57406495.0,1,0.52,2019_health.pdf
2019,health,66214,Heartland Natl Life Ins Co,2915982.0,1,10.2,2019_health.pdf
2019,health,95885,Humana Hlth Plan Inc,54263299.0,1,0.55,2019_health.pdf
2019,health,73288,Humana Ins Co,140277876.0,14,2.97,2019_health.pdf
2019,health,70580,Humanadental Ins Co,5164207.0,5,28.81,2019_health.pdf
2019,health,26581,Independence Amer Ins Co,2748216.0,1,10.83,2019_health.pdf
2019,health,13164,Indiana University Hlth Plans Inc,54773993.0,4,2.17,2019_health.pdf
2019,health,65331,Liberty Natl Life Ins Co,2107442.0,1,14.12,2019_health.pdf
2019,health,65498,Life Ins Co Of N Amer,44704644.0,1,0.67,2019_health.pdf
2019,health,99724,LifeShield Natl Ins Co,2588614.0,1,11.5,2019_health.pdf
2019,health,65676,Lincoln Natl Life Ins Co,31589550.0,1,0.94,2019_health.pdf
2019,health,61883,ManhattanLife Assur Co of Amer,3596350.0,2,16.55,2019_health.pdf
2019,health,65978,Metropolitan Life Ins Co,104895786.0,5,1.42,2019_health.pdf
2019,health,71412,Mutual Of Omaha Ins Co,21808090.0,1,1.36,2019_health.pdf
2019,health,68284,Nassau Life Ins Co of KS,1253532.0,2,47.48,2019_health.pdf
2019,health,62359,Nassau Life Ins Co of TX,1969979.0,2,30.21,2019_health.pdf
2019,health,82538,National Hlth Ins Co,26518145.0,9,10.1,2019_health.pdf
2019,health,19445,National Union Fire Ins Co Of Pitts,6928831.0,1,4.29,2019_health.pdf
2019,health,67598,Paul Revere Life Ins Co,2068621.0,1,14.38,2019_health.pdf
2019,health,67784,Philadelphia Amer Life Ins Co,25198062.0,1,1.18,2019_health.pdf
2019,health,80578,Physicians Mut Ins Co,10589702.0,1,2.81,2019_health.pdf
2019,health,39217,QBE Ins Corp,29204245.0,2,2.04,2019_health.pdf
2019,health,68381,Reliance Standard Life Ins Co,35061924.0,1,0.85,2019_health.pdf
2019,health,67105,Reliastar Life Ins Co,58370980.0,1,0.51,2019_health.pdf
2019,health,68462,Reserve Natl Ins Co,19418492.0,2,3.06,2019_health.pdf
2019,health,68802,Sentinel Security Life Ins Co,583251.0,1,,2019_health.pdf
2019,health,12575,SilverScript Ins Co,75098386.0,1,0.4,2019_health.pdf
2019,health,68985,Starmount Life Ins Co,4412985.0,1,6.74,2019_health.pdf
2019,health,69116,State Life Ins Co,380261.0,1,,2019_health.pdf
2019,health,96280,Superior Dental Care Inc,146934.0,1,,2019_health.pdf
2019,health,69477,Time Ins Co II,1471559.0,1,20.22,2019_health.pdf
2019,health,86231,Transamerica Life Ins Co,17236221.0,3,5.18,2019_health.pdf
2019,health,92525,TruAssure Ins Co,315465.0,1,,2019_health.pdf
2019,health,92916,United Amer Ins Co,10325396.0,1,2.88,2019_health.pdf
2019,health,85766,United Concordia Ins Co,266900.0,2,,2019_health.pdf
2019,health,69930,United Ins Co Of Amer,88690.0,1,,2019_health.pdf
2019,health,72850,United World Life Ins Co,44190966.0,1,0.67,2019_health.pdf
2019,health,79413,UnitedHealthcare Ins Co,1956244657.0,19,0.29,2019_health.pdf
2019,health,62235,Unum Life Ins Co Of Amer,48236196.0,1,0.62,2019_health.pdf
2019,health,70319,Washington Natl Ins Co,22271452.0,1,1.34,2019_health.pdf
2019,health,10155,WellCare Prescription Ins Inc,82954148.0,1,0.36,2019_health.pdf
2019,health,85189,Western United Life Assur Co,218309.0,1,,2019_health.pdf
2019,health,16535,Zurich Amer Ins Co,3723429.0,1,7.99,2019_health.pdf
2019,homeowners,19232,Allstate Ins Co,33435633.0,1,0.54,2019_homeowners.pdf
2019,homeowners,17230,Allstate Prop & Cas Ins Co,33443613.0,4,2.15,2019_homeowners.pdf
2019,homeowners,37907,Allstate Vehicle & Prop Ins Co,98275892.0,8,1.46,2019_homeowners.pdf
2019,homeowners,10111,American Bankers Ins Co Of FL,6497826.0,3,8.3,2019_homeowners.pdf
2019,homeowners,23450,American Family Home Ins Co,1321342.0,1,13.61,2019_homeowners.pdf
2019,homeowners,19275,American Family Mut Ins Co SI,67041321.0,2,0.54,2019_homeowners.pdf
2019,homeowners,38652,American Modern Select Ins Co,4141039.0,1,4.34,2019_homeowners.pdf
2019,homeowners,19976,Amica Mut Ins Co,6632523.0,1,2.71,2019_homeowners.pdf
2019,homeowners,10921,CSAA Fire & Cas Ins Co,5184993.0,1,3.47,2019_homeowners.pdf
2019,homeowners,20176,Celina Mut Ins Co,2216233.0,1,8.11,2019_homeowners.pdf
2019,homeowners,22640,Consolidated Ins Co,52500624.0,5,1.71,2019_homeowners.pdf
2019,homeowners,26263,Erie Ins Co,85664499.0,2,0.42,2019_homeowners.pdf
2019,homeowners,25712,Esurance Ins Co,3590190.0,1,5.01,2019_homeowners.pdf
2019,homeowners,21253,Garrison Prop & Cas Ins Co,5952657.0,1,3.02,2019_homeowners.pdf
2019,homeowners,14176,Hastings Mut Ins Co,13500549.0,2,2.66,2019_homeowners.pdf
2019,homeowners,17221,Homesite Ins Co,32479766.0,3,1.66,2019_homeowners.pdf
2019,homeowners,13927,Homesite Ins Co Of The Midwest,12197469.0,3,4.42,2019_homeowners.pdf
2019,homeowners,22624,Indiana Farmers Mut Ins Co,53336427.0,2,0.67,2019_homeowners.pdf
2019,homeowners,33600,LM Ins Corp,7840310.0,1,2.29,2019_homeowners.pdf
2019,homeowners,26123,Lightning Rod Mut Ins Co,6599071.0,1,2.73,2019_homeowners.pdf
2019,homeowners,21229,Memberselect Ins Co,11830538.0,1,1.52,2019_homeowners.pdf
2019,homeowners,23760,Nationwide Gen Ins Co,175996.0,1,,2019_homeowners.pdf
2019,homeowners,25453,Nationwide Ins Co Of Amer,18610292.0,1,0.97,2019_homeowners.pdf
2019,homeowners,37257,Praetorian Ins Co,2454337.0,1,7.33,2019_homeowners.pdf
2019,homeowners,38784,Progressive Southeastern Ins Co,7947973.0,1,2.26,2019_homeowners.pdf
2019,homeowners,34690,Property & Cas Ins Co Of Hartford,5924219.0,1,3.04,2019_homeowners.pdf
2019,homeowners,32905,Property Owners Ins Co,89951092.0,2,0.4,2019_homeowners.pdf
2019,homeowners,11215,Safeco Ins Co Of IN,90767609.0,3,0.59,2019_homeowners.pdf
2019,homeowners,23388,Shelter Mut Ins Co,12741754.0,1,1.41,2019_homeowners.pdf
2019,homeowners,19070,Standard Fire Ins Co,4488640.0,1,4.01,2019_homeowners.pdf
2019,homeowners,42986,Standard Guar Ins Co,17549.0,1,,2019_homeowners.pdf
2019,homeowners,25143,State Farm Fire & Cas Co,500100208.0,30,1.08,2019_homeowners.pdf
2019,homeowners,25180,Stillwater Ins Co,1770618.0,1,10.16,2019_homeowners.pdf
2019,homeowners,10677,The Cincinnati Ins Co,29675523.0,1,0.61,2019_homeowners.pdf
2019,homeowners,28188,Travco Ins Co,40590552.0,1,0.44,2019_homeowners.pdf
2019,homeowners,25666,Travelers Ind Co Of Amer,212112.0,1,,2019_homeowners.pdf
2019,homeowners,38130,Travelers Personal Ins Co,19804241.0,1,0.91,2019_homeowners.pdf
2019,homeowners,27120,Trumbull Ins Co,7664765.0,1,2.35,2019_homeowners.pdf
2019,homeowners,25968,USAA Cas Ins Co,19214502.0,1,0.94,2019_homeowners.pdf
2019,homeowners,18600,USAA Gen Ind Co,16055161.0,1,1.12,2019_homeowners.pdf
2019,homeowners,15288,United Farm Family Mut Ins Co,168706832.0,13,1.39,2019_homeowners.pdf
2019,homeowners,10861,Universal Prop & Cas Ins,16679468.0,6,6.47,2019_homeowners.pdf
2019,life,71854,AAA Life Ins Co,8430890.0,1,2.53,2019_life.pdf
2019,life,62200,Accordia Life & Ann Co,15256020.0,5,6.99,2019_life.pdf
2019,life,60054,Aetna Life Ins Co,4731168.0,1,4.51,2019_life.pdf
2019,life,92738,American Equity Invest Life Ins Co,33399.0,1,,2019_life.pdf
2019,life,60380,American Family Life Assur Co of Col,4764819.0,1,4.48,2019_life.pdf
2019,life,60488,American Gen Life Ins Co,37805176.0,3,1.69,2019_life.pdf
2019,life,60518,American Hlth & Life Ins Co,17177942.0,1,1.24,2019_life.pdf
2019,life,60577,American Income Life Ins Co,26343048.0,4,3.24,2019_life.pdf
2019,life,67989,American Memorial Life Ins Co,16064256.0,2,2.66,2019_life.pdf
2019,life,60739,American Natl Ins Co,5165649.0,1,4.13,2019_life.pdf
2019,life,60895,American United Life Ins Co,56812194.0,1,0.38,2019_life.pdf
2019,life,61689,Athene Ann & Life Co,3614042.0,14,82.61,2019_life.pdf
2019,life,61492,Athene Annuity & Life Assur Co,1469229.0,2,29.03,2019_life.pdf
2019,life,61263,Bankers Life & Cas Co,18524464.0,3,3.45,2019_life.pdf
2019,life,62626,CMFG Life Ins Co,17660186.0,1,1.21,2019_life.pdf
2019,life,61832,Chesapeake Life Ins Co,805840.0,1,,2019_life.pdf
2019,life,62049,Colonial Life & Accident Ins Co,4561368.0,1,4.68,2019_life.pdf
2019,life,76023,Columbian Life Ins Co,4645098.0,1,4.59,2019_life.pdf
2019,life,77828,Companion Life Ins Co,1154520.0,1,18.47,2019_life.pdf
2019,life,63274,Fidelity & Guar Life Ins Co,3612902.0,1,5.9,2019_life.pdf
2019,life,91642,Forethought Life Ins Co,7549112.0,3,8.47,2019_life.pdf
2019,life,65536,Genworth Life & Ann Ins Co,15606604.0,1,1.37,2019_life.pdf
2019,life,70939,Gerber Life Ins Co,11263177.0,1,1.89,2019_life.pdf
2019,life,91472,Globe Life & Accident Ins Co,20490940.0,6,6.24,2019_life.pdf
2019,life,83607,Guggenheim Life & Ann Co,23620.0,1,,2019_life.pdf
2019,life,73288,Humana Insurance Company,1802097.0,2,23.67,2019_life.pdf
2019,life,65056,Jackson Natl Life Ins Co,13167186.0,10,16.2,2019_life.pdf
2019,life,65838,John Hancock Life Ins Co USA,56075174.0,2,0.76,2019_life.pdf
2019,life,68543,Liberty Bankers Life Ins Co,815035.0,1,,2019_life.pdf
