year,line,naic_code,company_name,premium,complaints,complaint_index,source_file
2014,health,67539,Pan Amer Life Ins Co,7194472.0,1,5.914394944896582,2014_health.xlsx
2014,health,80578,Physicians Mut Ins Co,7983044.0,1,5.330165890104075,2014_health.xlsx
2014,health,68241,Prudential Ins Co Of Amer,17554688.0,1,2.4239080083906934,2014_health.xlsx
2014,health,68381,Reliance Standard Life Ins Co,22934353.0,2,3.710673575836214,2014_health.xlsx
2014,health,76325,Senior Hlth Ins Co of PA,3708405.0,1,11.474191418682695,2014_health.xlsx
2014,health,12575,SilverScript Ins Co,62242963.0,1,0.6836266587758684,2014_health.xlsx
2014,health,68608,Symetra Life Ins Co,28206405.0,1,1.5085562597573139,2014_health.xlsx
2014,health,69477,Time Ins Co,80936995.0,4,2.102917155646809,2014_health.xlsx
2014,health,86231,Transamerica Life Ins Co,20635001.0,1,2.0620764122085578,2014_health.xlsx
2014,health,80802,US Br Sun Life Assur Co of Canada,41431525.0,2,2.054037297830577,2014_health.xlsx
2014,health,69930,United Ins Co Of Amer,142993.0,1,,2014_health.xlsx
2014,health,69868,United Of Omaha Life Ins Co,94847023.0,1,0.448627141707969,2014_health.xlsx
2014,health,63479,United Teacher Assoc Ins Co,6403992.0,2,13.288882568248056,2014_health.xlsx
2014,health,79413,UnitedHealthcare Ins Co,1316891312.0,18,0.5816099414770837,2014_health.xlsx
2014,health,95776,UnitedHealthcare of IL Inc,-375.0,1,,2014_health.xlsx
2014,health,62235,Unum Life Ins Co Of Amer,49891956.0,1,0.852861908801491,2014_health.xlsx
2014,homeowners,33898,Aegis Security Insurance Company,728542.0,1,,2014_homeowners.xlsx
2014,homeowners,19240,Allstate Indemnity Company,2498961.0,2,19.711775925185616,2014_homeowners.xlsx
2014,homeowners,19232,Allstate Insurance Company,45755099.0,4,2.1531571498852085,2014_homeowners.xlsx
2014,homeowners,17230,Allstate Property And Casualty Insurance Company,58431436.0,5,2.1075538549907353,2014_homeowners.xlsx
2014,homeowners,19275,American Family Mutual Insurance Company,81690022.0,4,1.205996964421867,2014_homeowners.xlsx
2014,homeowners,38652,American Modern Select Insurance Company,5188327.0,1,4.747094706807972,2014_homeowners.xlsx
2014,homeowners,19992,American Select Insurance Company,6245114.0,1,3.9437998471907623,2014_homeowners.xlsx
2014,homeowners,10052,Chubb National Insurance Company,7680181.0,1,3.2068879156479366,2014_homeowners.xlsx
2014,homeowners,29734,Conifer Insurance Company,4560272.0,1,5.400879517469328,2014_homeowners.xlsx
2014,homeowners,40649,Economy Premier Assurance Company,1393820.0,1,17.67048803926539,2014_homeowners.xlsx
2014,homeowners,22292,Hanover Insurance Company,1171.0,1,,2014_homeowners.xlsx
2014,homeowners,13927,Homesite Insurance Company of the Midwest,18528214.0,2,2.6585918792700567,2014_homeowners.xlsx
2014,homeowners,22624,Indiana Farmers Mutual Insurance Company,45541821.0,1,0.5408101630123417,2014_homeowners.xlsx
2014,homeowners,33600,LM Insurance Corporation,11019915.0,1,2.2349972426183764,2014_homeowners.xlsx
2014,homeowners,42404,Liberty Insurance Corporation,11949914.0,1,2.0610591539728977,2014_homeowners.xlsx
2014,homeowners,23043,Liberty Mutual Insurance Company,,1,,2014_homeowners.xlsx
2014,homeowners,21229,MemberSelect Insurance Company,10050059.0,1,2.4506801043545003,2014_homeowners.xlsx
2014,homeowners,23353,Meridian Security Insurance Company,13528349.0,1,1.8205828101336599,2014_homeowners.xlsx
2014,homeowners,14621,Motorists Mutual Insurance Company,6307467.0,1,3.904813079305669,2014_homeowners.xlsx
2014,homeowners,23779,Nationwide Mutual Fire Insurance Company,18676418.0,1,1.31874750494923,2014_homeowners.xlsx
2014,homeowners,32700,Owners Insurance Company,26433189.0,3,2.795290379706613,2014_homeowners.xlsx
2014,homeowners,32905,Property-Owners Insurance Company,23933789.0,1,1.029067300580317,2014_homeowners.xlsx
2014,homeowners,11000,"Sentinel Insurance Company, Ltd.",1625531.0,1,15.151651761109992,2014_homeowners.xlsx
2014,homeowners,25143,State Farm Fire and Casualty Company,484909595.0,27,1.3713812989202658,2014_homeowners.xlsx
2014,homeowners,25178,State Farm Mutual Automobile Insurance Company,,1,,2014_homeowners.xlsx
2014,homeowners,40118,Trustgard Insurance Company,11905377.0,2,4.1375388009785645,2014_homeowners.xlsx
2014,homeowners,15288,United Farm Family Mutual Insurance Company,137742927.0,4,0.7152303258050815,2014_homeowners.xlsx
2014,homeowners,44393,West American Insurance Company,-35270.0,1,,2014_homeowners.xlsx
2014,life,62944,AXA Equitable Life Ins Co,16917560.0,1,1.4527636741854744,2014_life.xlsx
2014,life,90611,Allianz Life Ins Co Of N Amer,7362437.0,1,3.3381904149201156,2014_life.xlsx
2014,life,60186,Allstate Life Ins Co,8441521.0,1,2.9114678058436643,2014_life.xlsx
2014,life,60488,American Gen Life Ins Co,36630141.0,4,2.683824408303884,2014_life.xlsx
2014,life,60577,American Income Life Ins Co,19006218.0,1,1.2931145283008547,2014_life.xlsx
2014,life,60895,American United Life Ins Co,51381215.0,2,0.9566615590485049,2014_life.xlsx
2014,life,61689,Athene Ann & Life Co,12452613.0,4,7.894637574893948,2014_life.xlsx
2014,life,61492,Athene Annuity & Life Assur Co,2206567.0,2,22.27642906275061,2014_life.xlsx
2014,life,61093,Atlanta Life Ins Co,32595.0,1,,2014_life.xlsx
2014,life,61263,Bankers Life & Cas Co,20199838.0,4,4.86681459996921,2014_life.xlsx
2014,life,62065,Colonial Penn Life Ins Co,5563698.0,1,4.417424638047071,2014_life.xlsx
2014,life,62375,Consumers Life Ins Co,46385.0,1,,2014_life.xlsx
2014,life,79065,Delaware Life Ins Co,122852.0,2,,2014_life.xlsx
2014,life,62324,Freedom Life Ins Co Of Amer,349263.0,1,,2014_life.xlsx
2014,life,65536,Genworth Life & Ann Ins Co,18571093.0,1,1.323412500484124,2014_life.xlsx
2014,life,70939,Gerber Life Ins Co,8378270.0,1,2.933447671637846,2014_life.xlsx
2014,life,91472,Globe Life & Accident Ins Co,18366591.0,6,8.028887872720597,2014_life.xlsx
2014,life,70815,Hartford Life & Accident Ins Co,19707364.0,1,1.2471082699773148,2014_life.xlsx
2014,life,71153,Hartford Life & Ann Ins Co,16132052.0,1,1.5235021945040352,2014_life.xlsx
2014,life,64904,Investors Heritage Life Ins Co,1992408.0,1,12.335433617940307,2014_life.xlsx
2014,life,65056,Jackson Natl Life Ins Co,18121774.0,1,1.356225754931786,2014_life.xlsx
2014,life,65838,John Hancock Life Ins Co USA,62555228.0,1,0.39288829102906014,2014_life.xlsx
2014,life,65110,Kanawha Ins Co,1122852.0,1,21.88820665933998,2014_life.xlsx
2014,life,58033,Knights Of Columbus,15761522.0,1,1.5593174709811153,2014_life.xlsx
2014,life,65331,Liberty Natl Life Ins Co,2738172.0,1,8.975775306976047,2014_life.xlsx
2014,life,65498,Life Ins Co Of N Amer,25471071.0,2,1.9298141506380484,2014_life.xlsx
2014,life,65927,Lincoln Heritage Life Ins Co,5692688.0,1,4.317330692258774,2014_life.xlsx
2014,life,65676,Lincoln Natl Life Ins Co,105364768.0,1,0.23325839453139796,2014_life.xlsx
2014,life,65978,Metropolitan Life Ins Co,164950444.0,5,0.744987889327937,2014_life.xlsx
2014,life,66168,Minnesota Life Ins Co,62498454.0,1,0.3932451932947527,2014_life.xlsx
2014,life,66850,National Western Life Ins Co,3250690.0,1,7.56061532285552,2014_life.xlsx
2014,life,66915,New York Life Ins Co,60116565.0,2,0.8176520605877335,2014_life.xlsx
2014,life,66974,North Amer Co Life & Hlth Ins,20588769.0,1,1.1937195771079472,2014_life.xlsx
2014,life,72125,Physicians Life Ins Co,8374889.0,1,2.9346319245369354,2014_life.xlsx
2014,life,68136,Protective Life Ins Co,32020232.0,1,0.7675527342791648,2014_life.xlsx
2014,life,68241,Prudential Ins Co Of Amer,95422295.0,3,0.7726878699737795,2014_life.xlsx
2014,life,67105,Reliastar Life Ins Co,20889661.0,3,3.529576179889163,2014_life.xlsx
2014,life,68462,Reserve Natl Ins Co,591254.0,2,,2014_life.xlsx
2014,life,68675,Security Benefit Life Ins Co,337052.0,1,,2014_life.xlsx
2014,life,78662,Senior Life Ins Co,454681.0,1,,2014_life.xlsx
2014,life,69477,Time Ins Co,1039418.0,1,23.645171263007963,2014_life.xlsx
2014,life,86231,Transamerica Life Ins Co,41692123.0,6,3.536958282098498,2014_life.xlsx
2014,life,66281,Transamerica Premier Life Ins Co,28922516.0,7,5.948324702006301,2014_life.xlsx
2014,life,62596,Union Fidelity Life Ins Co,548756.0,1,,2014_life.xlsx
2014,life,69922,United Home Life Ins Co,1290912.0,1,19.038646029979745,2014_life.xlsx
2014,life,69930,United Ins Co Of Amer,2661910.0,7,64.63047825319883,2014_life.xlsx
2014,life,69868,United Of Omaha Life Ins Co,35815350.0,1,0.6862201995472113,2014_life.xlsx
2014,life,79413,UnitedHealthcare Ins Co,4654179.0,1,5.280677134217058,2014_life.xlsx
2014,life,70319,Washington Natl Ins Co,1037700.0,4,94.73727136495408,2014_life.xlsx
2014,life,65900,Wilco Life Ins Co,1987007.0,12,148.42755938264864,2014_life.xlsx
2015,annuity,60488,American Gen Life Ins Co,286231928.0,1,4.69,2015_annuity.pdf
2015,annuity,61492,Athene Annuity & Life Assur Co,3693884.0,1,363.05,2015_annuity.pdf
2015,annuity,63274,Fidelity & Guar Life Ins Co,26813432.0,1,50.02,2015_annuity.pdf
2015,annuity,91642,Forethought Life Ins Co,238107460.0,1,5.63,2015_annuity.pdf
2015,auto,44245,21st Century Assur Co,8074873.0,1,1.2,2015_auto.pdf
2015,auto,22667,Ace Amer Ins Co,9528.0,2,,2015_auto.pdf
2015,auto,42609,Affirmative Ins Co,3291905.0,7,20.65,2015_auto.pdf
2015,auto,12188,Alfa Vision Ins Corp,11933532.0,3,2.44,2015_auto.pdf
2015,auto,41840,Allmerica Financial Benefit Ins Co,,1,,2015_auto.pdf
2015,auto,29688,Allstate Fire and Casualty Ins Co,,2,,2015_auto.pdf
2015,auto,19240,Allstate Ind Co,11388811.0,3,2.56,2015_auto.pdf
2015,auto,19232,Allstate Ins Co,29430103.0,3,0.99,2015_auto.pdf
2015,auto,36455,Allstate Northbrook Ind Co,,1,,2015_auto.pdf
2015,auto,17230,Allstate Prop & Cas Ins Co,199761641.0,13,0.63,2015_auto.pdf
2015,auto,37907,Allstate Vehicle & Prop Ins Co,,1,,2015_auto.pdf
2015,auto,10730,American Access Cas Co,14002599.0,11,7.63,2015_auto.pdf
2015,auto,19941,American Commerce Ins Co,2617741.0,1,3.71,2015_auto.pdf
2015,auto,19275,American Family Mut Ins Co,122018976.0,5,0.4,2015_auto.pdf
2015,auto,10864,American Freedom Ins Co,6750264.0,3,4.32,2015_auto.pdf
2015,auto,19992,American Select Ins Co,12499136.0,1,0.78,2015_auto.pdf
2015,auto,19976,Amica Mut Ins Co,5180899.0,1,1.87,2015_auto.pdf
2015,auto,11558,AssuranceAmerica Ins Co,4148197.0,1,2.34,2015_auto.pdf
2015,auto,18988,Auto Owners Ins Co,38690383.0,1,0.25,2015_auto.pdf
2015,auto,19658,Bristol W Ins Co,11867937.0,1,0.82,2015_auto.pdf
2015,auto,37770,CSAA Gen Ins Co,31146434.0,2,0.62,2015_auto.pdf
2015,auto,20176,Celina Mut Ins Co,7287338.0,1,1.33,2015_auto.pdf
2015,auto,22640,Consolidated Ins Co,33128267.0,1,0.29,2015_auto.pdf
2015,auto,20443,Continental Cas Co,,1,,2015_auto.pdf
2015,auto,26263,Erie Ins Co,3785929.0,2,5.13,2015_auto.pdf
2015,auto,26271,Erie Ins Exch,112632573.0,6,0.52,2015_auto.pdf
2015,auto,25712,Esurance Ins Co,18855321.0,1,0.52,2015_auto.pdf
2015,auto,10336,First Acceptance Ins Co Inc,8405469.0,11,12.71,2015_auto.pdf
2015,auto,13587,First Chicago Ins Co,10932121.0,6,5.33,2015_auto.pdf
2015,auto,14249,Founders Ins Co,18707565.0,18,9.35,2015_auto.pdf
2015,auto,37923,GEICO Marine Insurance Co,,1,,2015_auto.pdf
2015,auto,21253,Garrison Prop & Cas Ins Co,7873481.0,2,2.47,2015_auto.pdf
2015,auto,41491,Geico Cas Co,116760949.0,21,1.75,2015_auto.pdf
2015,auto,35882,Geico Gen Ins Co,36887208.0,3,0.79,2015_auto.pdf
2015,auto,22055,Geico Ind Co,19978211.0,1,0.49,2015_auto.pdf
2015,auto,13703,General Automobile Insurance Co Inc,,3,,2015_auto.pdf
2015,auto,14044,Goodville Mut Cas Co,1201436.0,1,8.08,2015_auto.pdf
2015,auto,22292,Hanover Ins Co,15203815.0,1,0.64,2015_auto.pdf
2015,auto,29424,Hartford Cas Ins Co,372034.0,1,,2015_auto.pdf
2015,auto,14176,Hastings Mut Ins Co,19844509.0,1,0.49,2015_auto.pdf
2015,auto,25054,Hudson Insurance Company,,1,,2015_auto.pdf
2015,auto,21679,Illinois Farmers Ins Co,51177034.0,2,0.38,2015_auto.pdf
2015,auto,22624,Indiana Farmers Mut Ins Co,68020839.0,4,0.57,2015_auto.pdf
2015,auto,19429,Insurance Co Of The State Of PA,,1,,2015_auto.pdf
2015,auto,10922,Insuremax Ins Co,4680941.0,1,2.08,2015_auto.pdf
2015,auto,36447,LM Gen Ins Co,313509.0,2,,2015_auto.pdf
2015,auto,14941,Lighthouse Casualty Company,,2,,2015_auto.pdf
2015,auto,11198,Loya Ins Co,462938.0,2,,2015_auto.pdf
2015,auto,22306,Massachusetts Bay Ins Co,,1,,2015_auto.pdf
2015,auto,21229,Memberselect Ins Co,11342012.0,3,2.57,2015_auto.pdf
2015,auto,23353,Meridian Security Ins Co,4116752.0,1,2.36,2015_auto.pdf
2015,auto,34339,Metropolitan Grp Prop & Cas Ins Co,14937414.0,1,0.65,2015_auto.pdf
2015,auto,14621,Motorists Mut Ins Co,6957904.0,1,1.4,2015_auto.pdf
2015,auto,42447,National Gen Assur Co,4448245.0,2,4.37,2015_auto.pdf
2015,auto,19445,National Union Fire Ins Co Of Pitts,,2,,2015_auto.pdf
2015,auto,28223,Nationwide Agribusiness Ins Co,17660135.0,2,1.1,2015_auto.pdf
2015,auto,24082,Ohio Security Ins Co,,1,,2015_auto.pdf
2015,auto,34940,Omni Indemnity Company,,1,,2015_auto.pdf
2015,auto,37648,Permanent Gen Assur Corp,13897387.0,5,3.49,2015_auto.pdf
2015,auto,18058,Philadelphia Ind Ins Co,855882.0,1,,2015_auto.pdf
2015,auto,37257,Praetorian Insurance Company,,1,,2015_auto.pdf
2015,auto,16322,Progressive Direct Ins Co,,1,,2015_auto.pdf
2015,auto,44695,Progressive Paloverde Ins Co,183467992.0,15,0.79,2015_auto.pdf
2015,auto,37834,Progressive Preferred Ins Co,,1,,2015_auto.pdf
2015,auto,38784,Progressive Southeastern Ins Co,149318146.0,11,0.72,2015_auto.pdf
2015,auto,32905,Property-Owners Ins Co,,1,,2015_auto.pdf
2015,auto,12416,Protective Insurance Company,,1,,2015_auto.pdf
2015,auto,31089,Repwest Insurance Co,,1,,2015_auto.pdf
2015,auto,34509,Rider Ins Co,795815.0,1,,2015_auto.pdf
2015,auto,25405,Safe Auto Ins Co,26892619.0,12,4.33,2015_auto.pdf
2015,auto,11215,Safeco Ins Co Of IN,95334243.0,6,0.61,2015_auto.pdf
2015,auto,11000,Sentinel Ins Co Ltd,1701892.0,1,5.71,2015_auto.pdf
2015,auto,23388,Shelter Mut Ins Co,20002639.0,4,1.94,2015_auto.pdf
2015,auto,19070,Standard Fire Ins Co,24002719.0,3,1.21,2015_auto.pdf
2015,auto,25143,State Farm Fire & Cas Co,65928157.0,6,0.88,2015_auto.pdf
2015,auto,25178,State Farm Mut Auto Ins Co,740081665.0,44,0.58,2015_auto.pdf
2015,auto,28188,Travco Ins Co,20786959.0,2,0.93,2015_auto.pdf
2015,auto,27998,Travelers Home & Marine Ins Co,1153968.0,3,25.25,2015_auto.pdf
2015,auto,27120,Trumbull Ins Co,19353353.0,2,1.0,2015_auto.pdf
2015,auto,40118,Trustgard Ins Co,21594283.0,2,0.9,2015_auto.pdf
2015,auto,18600,USAA Gen Ind Co,19687253.0,2,0.99,2015_auto.pdf
2015,auto,10655,Unique Ins Co,5884807.0,9,14.86,2015_auto.pdf
2015,auto,35319,United Automobile Ins Co,462930.0,2,,2015_auto.pdf
2015,auto,15288,United Farm Family Mut Ins Co,248638038.0,13,0.51,2015_auto.pdf
2015,auto,25941,United Serv Automobile Assn,28066735.0,3,1.04,2015_auto.pdf
2015,auto,41181,Universal Underwriters Ins Co,,2,,2015_auto.pdf
2015,auto,10105,Victoria Select Ins Co,7944639.0,1,1.22,2015_auto.pdf
2015,auto,15350,West Bend Mut Ins Co,13211282.0,1,0.74,2015_auto.pdf
2015,auto,26131,Western Reserve Mut Cas Co,15150354.0,1,0.64,2015_auto.pdf
2015,auto,24120,Westfield Natl Ins Co,11590760.0,1,0.84,2015_auto.pdf
2015,auto,15407,Wolverine Mut Ins Co,3108298.0,1,3.12,2015_auto.pdf
2015,auto,27090,Young Amer Ins Co,438317.0,1,,2015_auto.pdf
2015,health,52568,Advantage Hlth Solutions Inc,211847303.0,6,0.3,2015_health.pdf
2015,health,60054,Aetna Life Ins Co,249252193.0,3,0.13,2015_health.pdf
2015,health,82406,All Savers Ins Co,163955164.0,144,9.4,2015_health.pdf
2015,health,19720,American Alt Ins Corp,8125776.0,1,1.32,2015_health.pdf
2015,health,60488,American Gen Life Ins Co,2915171.0,2,7.34,2015_health.pdf
2015,health,60534,American Heritage Life Ins Co,11622518.0,2,1.84,2015_health.pdf
2015,health,60577,American Income Life Ins Co,2686694.0,1,3.98,2015_health.pdf
2015,health,42978,American Security Ins Co,23061.0,1,,2015_health.pdf
2015,health,61301,Ameritas Life Ins Corp,14590853.0,2,1.47,2015_health.pdf
2015,health,28207,Anthem Ins Co Inc,2803480056.0,204,0.78,2015_health.pdf
2015,health,71439,Assurity Life Ins Co,2857570.0,1,3.75,2015_health.pdf
2015,health,38245,BCS Ins Co,4858566.0,1,2.2,2015_health.pdf
2015,health,61263,Bankers Life & Cas Co,31552848.0,2,0.68,2015_health.pdf
2015,health,10142,CareSource IN,59193166.0,62,11.21,2015_health.pdf
2015,health,61883,Central United Life Ins Co,1019314.0,1,10.5,2015_health.pdf
2015,health,10642,Cherokee Insurance Company,,1,,2015_health.pdf
2015,health,67369,Cigna Hlth & Life Ins Co,171867401.0,5,0.31,2015_health.pdf
2015,health,62049,Colonial Life & Accident Ins Co,11299561.0,1,0.95,2015_health.pdf
2015,health,62065,Colonial Penn Life Ins Co,19167178.0,3,1.68,2015_health.pdf
2015,health,77828,Companion Life Ins Co,32740826.0,2,0.65,2015_health.pdf
2015,health,60984,Compbenefits Ins Co,3194670.0,1,3.35,2015_health.pdf
2015,health,62359,Constitution Life Ins Co,3483703.0,3,9.22,2015_health.pdf
2015,health,20443,Continental Cas Co,9655993.0,1,1.11,2015_health.pdf
2015,health,95831,Coordinated Care Corp,27730973.0,48,18.53,2015_health.pdf
2015,health,81396,Delta Dental Insurance Company,,2,,2015_health.pdf
2015,health,52634,Delta Dental Plan of IN Inc,66385392.0,2,0.32,2015_health.pdf
2015,health,64149,EPIC Life Ins Co,1690757.0,1,6.33,2015_health.pdf
2015,health,13935,Federated Mut Ins Co,55852578.0,1,0.19,2015_health.pdf
2015,health,91642,Forethought Life Ins Co,10398386.0,1,1.03,2015_health.pdf
2015,health,62324,Freedom Life Ins Co Of Amer,3672848.0,2,5.83,2015_health.pdf
2015,health,70025,Genworth Life Ins Co,50110736.0,1,0.21,2015_health.pdf
2015,health,62286,Golden Rule Ins Co,66834447.0,5,0.8,2015_health.pdf
2015,health,64211,Guarantee Trust Life Ins Co,5571522.0,1,1.92,2015_health.pdf
2015,health,64246,Guardian Life Ins Co Of Amer,59427985.0,2,0.36,2015_health.pdf
2015,health,92711,HCC Life Ins Co,67346053.0,5,0.79,2015_health.pdf
2015,health,71153,Hartford Life & Ann Ins Co,5241.0,1,,2015_health.pdf
2015,health,95885,Humana Hlth Plan Inc,24068089.0,3,1.33,2015_health.pdf
2015,health,73288,Humana Ins Co,228947149.0,14,0.65,2015_health.pdf
2015,health,70580,Humanadental Ins Co,14921191.0,3,2.15,2015_health.pdf
2015,health,13164,Indiana University Hlth Plans Inc,6316037.0,2,3.39,2015_health.pdf
2015,health,65080,John Alden Life Ins Co,5023959.0,1,2.13,2015_health.pdf
2015,health,65838,John Hancock Life Ins Co USA,28342403.0,2,0.76,2015_health.pdf
2015,health,65498,Life Ins Co Of N Amer,26670609.0,3,1.2,2015_health.pdf
2015,health,65676,Lincoln Natl Life Ins Co,47020725.0,2,0.46,2015_health.pdf
2015,health,15584,MDwise Marketplace Inc,104463471.0,106,10.86,2015_health.pdf
2015,health,65781,Madison Natl Life Ins Co Inc,8349939.0,1,1.28,2015_health.pdf
2015,health,65978,Metropolitan Life Ins Co,85317165.0,20,2.51,2015_health.pdf
2015,health,82538,National Hlth Ins Co,2931055.0,1,3.65,2015_health.pdf
2015,health,66869,Nationwide Life Ins Co,6590216.0,1,1.62,2015_health.pdf
2015,health,67539,Pan Amer Life Ins Co,5672190.0,1,1.89,2015_health.pdf
2015,health,67660,Pennsylvania Life Ins Co,1854488.0,2,11.54,2015_health.pdf
2015,health,61271,Principal Life Ins Co,29731525.0,2,0.72,2015_health.pdf
2015,health,68195,Provident Life & Accident Ins Co,10585752.0,1,1.01,2015_health.pdf
2015,health,68241,Prudential Ins Co Of Amer,16260500.0,1,0.66,2015_health.pdf
2015,health,68284,Pyramid Life Ins Co,2718125.0,2,7.88,2015_health.pdf
2015,health,61700,Renaissance Life & Hlth Ins Co of Am,3176528.0,1,3.37,2015_health.pdf
2015,health,76325,Senior Hlth Ins Co of PA,3235783.0,4,13.23,2015_health.pdf
2015,health,12575,SilverScript Ins Co,57037178.0,4,0.75,2015_health.pdf
2015,health,95812,Southeastern IN Hlth Org Inc,39321659.0,2,0.54,2015_health.pdf
2015,health,69019,Standard Ins Co,13588950.0,2,1.58,2015_health.pdf
2015,health,69477,Time Ins Co,88262773.0,18,2.18,2015_health.pdf
2015,health,86231,Transamerica Life Ins Co,31254391.0,3,1.03,2015_health.pdf
2015,health,66281,Transamerica Premier Life Ins Co,31687259.0,4,1.35,2015_health.pdf
2015,health,80802,US Br Sun Life Assur Co of Canada,33694465.0,1,0.32,2015_health.pdf
2015,health,97772,US Hlth & Life Ins Co Inc,4763653.0,1,2.25,2015_health.pdf
2015,health,11121,Unified Life Ins Co,1239594.0,1,8.64,2015_health.pdf
2015,health,69868,United Of Omaha Life Ins Co,93318420.0,1,0.11,2015_health.pdf
2015,health,79413,UnitedHealthcare Ins Co,1384398445.0,28,0.22,2015_health.pdf
2015,health,97179,UnitedHealthcare Life Ins Co,73200170.0,13,1.9,2015_health.pdf
2015,health,62235,Unum Life Ins Co Of Amer,44443352.0,1,0.24,2015_health.pdf
2015,homeowners,19240,Allstate Ind Co,2848281.0,2,10.82,2015_homeowners.pdf
2015,homeowners,19232,Allstate Ins Co,43168415.0,3,1.07,2015_homeowners.pdf
2015,homeowners,17230,Allstate Prop & Cas Ins Co,52567992.0,5,1.47,2015_homeowners.pdf
2015,homeowners,37907,Allstate Vehicle & Prop Ins Co,37559289.0,6,2.46,2015_homeowners.pdf
2015,homeowners,19100,Amco Ins Co,1470786.0,1,10.47,2015_homeowners.pdf
2015,homeowners,10111,American Bankers Ins Co Of FL,4514732.0,1,3.41,2015_homeowners.pdf
2015,homeowners,23450,American Family Home Ins Co,2042724.0,1,7.54,2015_homeowners.pdf
2015,homeowners,19275,American Family Mut Ins Co,85096213.0,5,0.91,2015_homeowners.pdf
2015,homeowners,21857,American Ins Co,1025984.0,1,15.01,2015_homeowners.pdf
2015,homeowners,23469,American Modern Home Ins Co,3148175.0,1,4.89,2015_homeowners.pdf
2015,homeowners,38652,American Modern Select Ins Co,5933291.0,2,5.19,2015_homeowners.pdf
2015,homeowners,19615,American Reliable Ins Co,174017.0,1,,2015_homeowners.pdf
2015,homeowners,19976,Amica Mut Ins Co,5296015.0,1,2.91,2015_homeowners.pdf
2015,homeowners,18988,Auto Owners Ins Co,17879190.0,3,2.58,2015_homeowners.pdf
2015,homeowners,10921,CSAA Fire & Cas Ins Co,20418060.0,3,2.26,2015_homeowners.pdf
2015,homeowners,20230,Central Mut Ins Co,7545540.0,1,2.04,2015_homeowners.pdf
2015,homeowners,10677,Cincinnati Ins Co,37140513.0,2,0.83,2015_homeowners.pdf
2015,homeowners,10395,Citizens Ins Co Of The Midwest,12519030.0,1,1.23,2015_homeowners.pdf
2015,homeowners,29734,Conifer Ins Co,3833608.0,3,12.05,2015_homeowners.pdf
2015,homeowners,26263,Erie Ins Co,46933168.0,1,0.33,2015_homeowners.pdf
2015,homeowners,26271,Erie Ins Exch,52883688.0,10,2.91,2015_homeowners.pdf
2015,homeowners,24201,Farmers Automobile Ins Assoc,13307898.0,2,2.31,2015_homeowners.pdf
2015,homeowners,21652,Farmers Ins Exch,25016017.0,1,0.62,2015_homeowners.pdf
2015,homeowners,15032,Guideone Mut Ins Co,1660105.0,1,9.28,2015_homeowners.pdf
2015,homeowners,13927,Homesite Ins Co Of The Midwest,17755684.0,3,2.6,2015_homeowners.pdf
2015,homeowners,29068,IDS Prop Cas Ins Co,7557143.0,1,2.04,2015_homeowners.pdf
2015,homeowners,22624,Indiana Farmers Mut Ins Co,47734898.0,4,1.29,2015_homeowners.pdf
2015,homeowners,33600,LM Ins Corp,12899502.0,2,2.39,2015_homeowners.pdf
2015,homeowners,26123,Lightning Rod Mut Ins Co,10362392.0,1,1.49,2015_homeowners.pdf
2015,homeowners,21229,Memberselect Ins Co,10501373.0,1,1.47,2015_homeowners.pdf
2015,homeowners,23353,Meridian Security Ins Co,12445354.0,1,1.24,2015_homeowners.pdf
2015,homeowners,26298,Metropolitan Prop & Cas Ins Co,14525914.0,1,1.06,2015_homeowners.pdf
2015,homeowners,14621,Motorists Mut Ins Co,5235396.0,1,2.94,2015_homeowners.pdf
2015,homeowners,32700,Owners Ins Co,25873009.0,1,0.6,2015_homeowners.pdf
2015,homeowners,32905,Property Owners Ins Co,24490291.0,1,0.63,2015_homeowners.pdf
2015,homeowners,13056,RLI Ins Co,26057.0,1,,2015_homeowners.pdf
2015,homeowners,11215,Safeco Ins Co Of IN,75892718.0,7,1.42,2015_homeowners.pdf
2015,homeowners,19259,Selective Ins Co Of SC,12321464.0,1,1.25,2015_homeowners.pdf
2015,homeowners,39926,Selective Ins Co Of The Southeast,847667.0,1,,2015_homeowners.pdf
2015,homeowners,23388,Shelter Mut Ins Co,13812747.0,1,1.12,2015_homeowners.pdf
2015,homeowners,25143,State Farm Fire & Cas Co,510516197.0,22,0.66,2015_homeowners.pdf
2015,homeowners,28188,Travco Ins Co,36677899.0,5,2.1,2015_homeowners.pdf
2015,homeowners,15288,United Farm Family Mut Ins Co,139711700.0,4,0.44,2015_homeowners.pdf
2015,homeowners,25941,United Serv Automobile Assn,22544472.0,1,0.68,2015_homeowners.pdf
2015,homeowners,26131,Western Reserve Mut Cas Co,5155780.0,1,2.99,2015_homeowners.pdf
2015,homeowners,24120,Westfield Natl Ins Co,10145913.0,1,1.52,2015_homeowners.pdf
2015,life,62944,AXA Equitable Life Ins Co,16917560.0,1,1.45,2015_life.pdf
2015,life,90611,Allianz Life Ins Co Of N Amer,7362437.0,1,3.34,2015_life.pdf
2015,life,60186,Allstate Life Ins Co,8441521.0,1,2.91,2015_life.pdf
2015,life,60488,American Gen Life Ins Co,36630141.0,4,2.68,2015_life.pdf
2015,life,60577,American Income Life Ins Co,19006218.0,1,1.29,2015_life.pdf
2015,life,60895,American United Life Ins Co,51381215.0,2,0.96,2015_life.pdf
2015,life,61689,Athene Ann & Life Co,12452613.0,4,7.89,2015_life.pdf
2015,life,61492,Athene Annuity & Life Assur Co,2206567.0,2,22.28,2015_life.pdf
2015,life,61093,Atlanta Life Ins Co,32595.0,1,,2015_life.pdf
2015,life,61263,Bankers Life & Cas Co,20199838.0,4,4.87,2015_life.pdf
2015,life,62065,Colonial Penn Life Ins Co,5563698.0,1,4.42,2015_life.pdf
2015,life,62375,Consumers Life Ins Co,46385.0,1,,2015_life.pdf
2015,life,79065,Delaware Life Ins Co,122852.0,2,,2015_life.pdf
2015,life,62324,Freedom Life Ins Co Of Amer,349263.0,1,,2015_life.pdf
2015,life,65536,Genworth Life & Ann Ins Co,18571093.0,1,1.32,2015_life.pdf
2015,life,70939,Gerber Life Ins Co,8378270.0,1,2.93,2015_life.pdf
2015,life,91472,Globe Life & Accident Ins Co,18366591.0,6,8.03,2015_life.pdf
2015,life,70815,Hartford Life & Accident Ins Co,19707364.0,1,1.25,2015_life.pdf
2015,life,71153,Hartford Life & Ann Ins Co,16132052.0,1,1.52,2015_life.pdf
2015,life,64904,Investors Heritage Life Ins Co,1992408.0,1,12.34,2015_life.pdf
2015,life,65056,Jackson Natl Life Ins Co,18121774.0,1,1.36,2015_life.pdf
2015,life,65838,John Hancock Life Ins Co USA,62555228.0,1,0.39,2015_life.pdf
2015,life,65110,Kanawha Ins Co,1122852.0,1,21.89,2015_life.pdf
2015,life,58033,Knights Of Columbus,15761522.0,1,1.56,2015_life.pdf
2015,life,65331,Liberty Natl Life Ins Co,2738172.0,1,8.98,2015_life.pdf
2015,life,65498,Life Ins Co Of N Amer,25471071.0,2,1.93,2015_life.pdf
