year,line,naic_code,company_name,premium,complaints,complaint_index,source_file
2011,health,61271,Principal Life Ins Co,55471848.0,2,0.32,2011_health.pdf
2011,health,68136,Protective Life Ins Co,736788.0,1,,2011_health.pdf
2011,health,67903,Provident Amer Life & Hlth Ins Co,351681.0,3,,2011_health.pdf
2011,health,68241,Prudential Ins Co Of Amer,16026386.0,1,0.55,2011_health.pdf
2011,health,71390,Puritan Life Ins Co of Amer,2819475.0,28,88.22,2011_health.pdf
2011,health,68284,Pyramid Life Ins Co,123542444.0,3,0.22,2011_health.pdf
2011,health,68381,Reliance Standard Life Ins Co,10776969.0,2,1.65,2011_health.pdf
2011,health,61700,Renaissance Life & Hlth Ins Co of Am,2306833.0,2,7.7,2011_health.pdf
2011,health,68462,Reserve Natl Ins Co,11887984.0,6,4.48,2011_health.pdf
2011,health,76325,Senior Hlth Ins Co of PA,5693350.0,6,9.36,2011_health.pdf
2011,health,12575,SilverScript Ins Co,20384321.0,2,0.87,2011_health.pdf
2011,health,95812,Southeastern IN Hlth Organization,48064755.0,1,0.18,2011_health.pdf
2011,health,69019,Standard Ins Co,10999780.0,2,1.62,2011_health.pdf
2011,health,65021,Stonebridge Life Ins Co,6720917.0,1,1.32,2011_health.pdf
2011,health,80926,Sun Life & Hlth Ins Co,5309559.0,9,15.06,2011_health.pdf
2011,health,69477,Time Ins Co,42143182.0,3,0.63,2011_health.pdf
2011,health,86231,Transamerica Life Ins Co,16263974.0,1,0.55,2011_health.pdf
2011,health,61425,Trustmark Ins Co,2266542.0,10,39.19,2011_health.pdf
2011,health,62235,UNUM Life Ins Co Of Amer,47773292.0,2,0.37,2011_health.pdf
2011,health,80802,US Br Sun Life Assur Co of Canada,43727994.0,9,1.83,2011_health.pdf
2011,health,80314,Unicare Life & Hlth Ins Co,13056096.0,1,0.68,2011_health.pdf
2011,health,69701,Union Bankers Ins Co,2903984.0,1,3.06,2011_health.pdf
2011,health,70408,Union Security Ins Co,8941130.0,3,2.98,2011_health.pdf
2011,health,92916,United Amer Ins Co,22298806.0,1,0.4,2011_health.pdf
2011,health,85766,United Concordia Ins Co,52998.0,10,,2011_health.pdf
2011,health,69868,United Of Omaha Life Ins Co,61164006.0,4,0.58,2011_health.pdf
2011,health,81108,United Security Life & Hlth Ins Co,7752531.0,3,3.44,2011_health.pdf
2011,health,21113,United States Fire Ins Co,4276554.0,1,2.08,2011_health.pdf
2011,health,70106,United States Life Ins Co In NYC,3103204.0,1,2.86,2011_health.pdf
2011,health,63479,United Teacher Assoc Ins Co,7431029.0,5,5.98,2011_health.pdf
2011,health,72850,United World Life Ins Co,61151974.0,115,16.71,2011_health.pdf
2011,health,79413,UnitedHealthcare Ins Co,1030252236.0,6,0.05,2011_health.pdf
2011,health,70319,Washington Natl Ins Co,18589028.0,4,1.91,2011_health.pdf
2011,health,83445,Wellcare Hlth Ins of AZ Inc,77115.0,1,,2011_health.pdf
2011,health,10155,Wellcare Prescription Ins Inc,16485659.0,2,1.08,2011_health.pdf
2011,health,70629,World Ins Co,6658135.0,2,2.67,2011_health.pdf
2011,health,16535,Zurich Amer Ins Co,22938252.0,2,0.77,2011_health.pdf
2011,homeowners,10921,ACA Insurance Company,15557785.0,10,1.53,2011_homeowners.pdf
2011,homeowners,14184,"ACUITY, a Mutual Insurance Company",2150760.0,1,1.1,2011_homeowners.pdf
2011,homeowners,19100,AMCO Insurance Company,6133111.0,1,0.39,2011_homeowners.pdf
2011,homeowners,42579,Allied Property And Casualty Insurance Company,1885019.0,1,1.26,2011_homeowners.pdf
2011,homeowners,19240,Allstate Indemnity Company,2061563.0,8,9.22,2011_homeowners.pdf
2011,homeowners,19232,Allstate Insurance Company,52887120.0,22,0.99,2011_homeowners.pdf
2011,homeowners,17230,Allstate Property And Casualty Insurance Company,55124101.0,35,1.51,2011_homeowners.pdf
2011,homeowners,10111,American Bankers Insurance Company of Florida,2031850.0,4,4.68,2011_homeowners.pdf
2011,homeowners,19941,American Commerce Insurance Company,2789167.0,2,1.7,2011_homeowners.pdf
2011,homeowners,23450,American Family Home Insurance Company,2561578.0,3,2.78,2011_homeowners.pdf
2011,homeowners,19275,American Family Mutual Insurance Company,73445086.0,37,1.2,2011_homeowners.pdf
2011,homeowners,43494,American Hallmark Insurance Company of Texas,702447.0,1,,2011_homeowners.pdf
2011,homeowners,38652,American Modern Select Insurance Company,3177834.0,4,2.99,2011_homeowners.pdf
2011,homeowners,28401,American National Property And Casualty Company,4089805.0,2,1.16,2011_homeowners.pdf
2011,homeowners,19615,American Reliable Insurance Company,465336.0,1,,2011_homeowners.pdf
2011,homeowners,42978,American Security Insurance Company,459023.0,5,,2011_homeowners.pdf
2011,homeowners,19976,Amica Mutual Insurance Company,3370501.0,1,0.7,2011_homeowners.pdf
2011,homeowners,18988,Auto-Owners Insurance Company,18888986.0,31,3.9,2011_homeowners.pdf
2011,homeowners,19062,Automobile Insurance Company Of Hartford,724731.0,2,,2011_homeowners.pdf
2011,homeowners,16713,Buckeye State Mutual Insurance Company,2897318.0,1,0.82,2011_homeowners.pdf
2011,homeowners,20117,California Casualty Indemnity Exchange,911558.0,1,,2011_homeowners.pdf
2011,homeowners,10677,Cincinnati Insurance Company,30956192.0,8,0.61,2011_homeowners.pdf
2011,homeowners,10395,Citizen's Insurance Company Of The Midwest,11926377.0,6,1.2,2011_homeowners.pdf
2011,homeowners,40649,Economy Premier Assurance Company,1850051.0,1,1.28,2011_homeowners.pdf
2011,homeowners,21326,Empire Fire And Marine Insurance Company,1334074.0,1,1.78,2011_homeowners.pdf
2011,homeowners,26271,Erie Insurance Exchange,56497810.0,21,0.88,2011_homeowners.pdf
2011,homeowners,24201,Farmers Automobile Insurance Association,14939625.0,3,0.48,2011_homeowners.pdf
2011,homeowners,21652,Farmers Insurance Exchange,16825161.0,7,0.99,2011_homeowners.pdf
2011,homeowners,16578,Fidelity National Property and Casualty Insurance Co,,1,,2011_homeowners.pdf
2011,homeowners,11185,Foremost Insurance Company,5235823.0,8,3.63,2011_homeowners.pdf
2011,homeowners,11800,Foremost Property And Casualty Insurance Company,1427742.0,1,1.66,2011_homeowners.pdf
2011,homeowners,41513,Foremost Signature Insurance Company,2637133.0,3,2.7,2011_homeowners.pdf
2011,homeowners,14044,Goodville Mutual Casualty Company,696669.0,2,,2011_homeowners.pdf
2011,homeowners,22098,Grain Dealers Mutual Insurance Company,814419.0,2,,2011_homeowners.pdf
2011,homeowners,15032,GuideOne Mutual Insurance Company,3006855.0,4,3.16,2011_homeowners.pdf
2011,homeowners,42331,Guideone America Insurance Company,246377.0,2,,2011_homeowners.pdf
2011,homeowners,14125,Hamilton Mutual Insurance Company,1963580.0,2,2.42,2011_homeowners.pdf
2011,homeowners,22292,Hanover Insurance Company,3036.0,1,,2011_homeowners.pdf
2011,homeowners,23582,Harleysville Insurance Company,,1,,2011_homeowners.pdf
2011,homeowners,14516,Harleysville Lake States Insurance Company,3365292.0,1,0.71,2011_homeowners.pdf
2011,homeowners,19682,Hartford Fire Insurance Company,298167.0,2,,2011_homeowners.pdf
2011,homeowners,37478,Hartford Insurance Company Of The Midwest,10185.0,1,,2011_homeowners.pdf
2011,homeowners,30104,Hartford Underwriters Insurance Company,3564254.0,1,0.67,2011_homeowners.pdf
2011,homeowners,14176,Hastings Mutual Insurance Company,16085344.0,8,1.18,2011_homeowners.pdf
2011,homeowners,13927,Homesite Insurance Company of the Midwest,11756150.0,21,4.24,2011_homeowners.pdf
2011,homeowners,27570,Hoosier Insurance Company,5884044.0,1,0.4,2011_homeowners.pdf
2011,homeowners,22578,Horace Mann Insurance Company,878689.0,2,,2011_homeowners.pdf
2011,homeowners,21679,Illinois Farmers Insurance Company,18902844.0,6,0.75,2011_homeowners.pdf
2011,homeowners,27960,Illinois Union Insurance Company,,1,,2011_homeowners.pdf
2011,homeowners,22624,Indiana Farmers Mutual Insurance Company,36542921.0,17,1.11,2011_homeowners.pdf
2011,homeowners,22659,Indiana Insurance Company,36926069.0,14,0.9,2011_homeowners.pdf
2011,homeowners,42404,Liberty Insurance Corporation,9414087.0,2,0.5,2011_homeowners.pdf
2011,homeowners,23035,Liberty Mutual Fire Insurance Company,21322337.0,12,1.34,2011_homeowners.pdf
2011,homeowners,26123,Lightning Rod Mutual Insurance Company,8254155.0,1,0.29,2011_homeowners.pdf
2011,homeowners,21229,MemberSelect Insurance Company,9164403.0,6,1.56,2011_homeowners.pdf
2011,homeowners,23353,Meridian Security Insurance Company,18262284.0,6,0.78,2011_homeowners.pdf
2011,homeowners,34339,Metropolitan Group Property And Casualty Insurance Co,4989679.0,2,0.95,2011_homeowners.pdf
2011,homeowners,26298,Metropolitan Property And Casualty Insurance Company,13248230.0,1,0.18,2011_homeowners.pdf
2011,homeowners,16764,Miami Mutual Insurance Company,461166.0,4,,2011_homeowners.pdf
2011,homeowners,14621,Motorists Mutual Insurance Company,7370666.0,5,1.61,2011_homeowners.pdf
2011,homeowners,20184,National Mutual Insurance Company,7611727.0,2,0.62,2011_homeowners.pdf
2011,homeowners,26093,Nationwide Affinity Insurance Company of America,5243998.0,3,1.36,2011_homeowners.pdf
2011,homeowners,23779,Nationwide Mutual Fire Insurance Company,17359424.0,15,2.05,2011_homeowners.pdf
2011,homeowners,27740,North Pointe Insurance Company,2566465.0,9,8.33,2011_homeowners.pdf
2011,homeowners,32700,Owners Insurance Company,21337676.0,3,0.33,2011_homeowners.pdf
2011,homeowners,24228,Pekin Insurance Company,6814978.0,2,0.7,2011_homeowners.pdf
2011,homeowners,38784,Progressive Southeastern Insurance Company,4568788.0,8,4.16,2011_homeowners.pdf
2011,homeowners,34690,Property And Casualty Insurance Company Of Hartford,10283437.0,2,0.46,2011_homeowners.pdf
2011,homeowners,32905,Property-Owners Insurance Company,22711739.0,7,0.73,2011_homeowners.pdf
2011,homeowners,27065,Rockford Mutual Insurance Company,61969.0,1,,2011_homeowners.pdf
2011,homeowners,24740,Safeco Insurance Company Of America,8170886.0,3,0.87,2011_homeowners.pdf
2011,homeowners,41297,Scottsdale Insurance Company,,2,,2011_homeowners.pdf
2011,homeowners,19259,Selective Insurance Company Of South Carolina,8592383.0,4,1.11,2011_homeowners.pdf
2011,homeowners,39926,Selective Insurance Company of the Southeast,1558667.0,4,6.1,2011_homeowners.pdf
2011,homeowners,11000,"Sentinel Insurance Company, Ltd.",2948256.0,3,2.42,2011_homeowners.pdf
2011,homeowners,24988,Sentry Insurance A Mutual Company,3938445.0,2,1.21,2011_homeowners.pdf
2011,homeowners,23388,Shelter Mutual Insurance Company,10096785.0,8,1.88,2011_homeowners.pdf
2011,homeowners,19070,Standard Fire Insurance Company,11686437.0,8,1.63,2011_homeowners.pdf
2011,homeowners,15199,Standard Mutual Insurance Company,6226320.0,5,1.91,2011_homeowners.pdf
2011,homeowners,25135,State Automobile Mutual Insurance Company,6520884.0,2,0.73,2011_homeowners.pdf
2011,homeowners,25143,State Farm Fire and Casualty Company,412390582.0,110,0.63,2011_homeowners.pdf
2011,homeowners,22683,Teachers Insurance Company,2406702.0,2,1.97,2011_homeowners.pdf
2011,homeowners,28188,Travco Insurance Company,26155673.0,10,0.91,2011_homeowners.pdf
2011,homeowners,40118,Trustgard Insurance Company,6981723.0,3,1.02,2011_homeowners.pdf
2011,homeowners,25968,USAA Casualty Insurance Company,10657717.0,1,0.22,2011_homeowners.pdf
2011,homeowners,18600,USAA General Indemnity Company,2389371.0,1,0.99,2011_homeowners.pdf
2011,homeowners,15288,United Farm Family Mutual Insurance Company,125550381.0,31,0.59,2011_homeowners.pdf
2011,homeowners,25941,United Services Automobile Association,17260366.0,3,0.41,2011_homeowners.pdf
2011,homeowners,10915,Unitrin Direct Property & Casualty Company,87836.0,1,,2011_homeowners.pdf
2011,homeowners,15350,West Bend Mutual Insurance Company,4676123.0,1,0.51,2011_homeowners.pdf
2011,homeowners,26131,Western Reserve Mutual Casualty Company,5401917.0,1,0.44,2011_homeowners.pdf
2011,homeowners,24112,Westfield Insurance Company,4259394.0,2,1.12,2011_homeowners.pdf
2011,homeowners,24120,Westfield National Insurance Company,12410910.0,4,0.77,2011_homeowners.pdf
2011,homeowners,15407,Wolverine Mutual Insurance Company,4586239.0,3,1.55,2011_homeowners.pdf
2011,life,71854,AAA Life Ins Co,3580265.0,2,3.63,2011_life.pdf
2011,life,62944,AXA Equitable Life Ins Co,19934523.0,4,1.3,2011_life.pdf
2011,life,71471,Ability Ins Co,1890.0,1,,2011_life.pdf
2011,life,60054,Aetna Life Ins Co,7762682.0,2,1.67,2011_life.pdf
2011,life,60186,Allstate Life Ins Co,10349129.0,5,3.14,2011_life.pdf
2011,life,60291,American Capitol Ins Co,92996.0,3,,2011_life.pdf
2011,life,92738,American Equity Invest Life Ins Co,250997.0,1,,2011_life.pdf
2011,life,60399,American Family Life Ins Co,17705931.0,3,1.1,2011_life.pdf
2011,life,66672,American Gen Life & Acc Ins Co,9720964.0,14,9.35,2011_life.pdf
2011,life,60488,American Gen Life Ins Co,10058486.0,3,1.94,2011_life.pdf
2011,life,60577,American Income Life Ins Co,12973268.0,2,1.0,2011_life.pdf
2011,life,60739,American Natl Ins Co,3599580.0,1,1.8,2011_life.pdf
2011,life,60895,American United Life Ins Co,56088575.0,3,0.35,2011_life.pdf
2011,life,61069,Anthem Life Ins Co,20970176.0,2,0.62,2011_life.pdf
2011,life,61689,Aviva Life & Ann Co,26303854.0,6,1.48,2011_life.pdf
2011,life,61263,Bankers Life & Cas Co,14284927.0,17,7.72,2011_life.pdf
2011,life,94250,Banner Life Ins Co,9875700.0,1,0.66,2011_life.pdf
2011,life,71463,CICA Life Ins Co of Amer,1662553.0,1,3.9,2011_life.pdf
2011,life,61832,Chesapeake Life Ins Co,847335.0,1,,2011_life.pdf
2011,life,76236,Cincinnati Life Ins Co,15298300.0,1,0.42,2011_life.pdf
2011,life,62049,Colonial Life & Accident Ins Co,3166254.0,1,2.05,2011_life.pdf
2011,life,62065,Colonial Penn Life Ins Co,4450303.0,2,2.92,2011_life.pdf
2011,life,84786,Colorado Bankers Life Ins Co,1030233.0,1,6.3,2011_life.pdf
2011,life,62103,Columbian Mut Life Ins Co,210604.0,1,,2011_life.pdf
2011,life,62146,Combined Ins Co Of Amer,1897371.0,2,6.84,2011_life.pdf
2011,life,62308,Connecticut Gen Life Ins Co,3512345.0,1,1.85,2011_life.pdf
2011,life,60682,Conseco Insurance Company,,1,,2011_life.pdf
2011,life,65900,Conseco Life Ins Co,3478365.0,15,27.99,2011_life.pdf
2011,life,71404,Continental Gen Ins Co,283084.0,1,,2011_life.pdf
2011,life,68500,Continental Life Ins Co Brentwood,58142.0,1,,2011_life.pdf
2011,life,62626,Cuna Mut Ins Society,11380343.0,2,1.14,2011_life.pdf
2011,life,63177,Farmers New World Life Ins Co,7520446.0,2,1.73,2011_life.pdf
2011,life,63274,Fidelity & Guar Life Ins Co,5805920.0,3,3.35,2011_life.pdf
2011,life,63290,Fidelity Life Assn A Legal Reserve L,1396054.0,1,4.65,2011_life.pdf
2011,life,67652,First Penn Pacific Life Ins Co,4123762.0,1,1.57,2011_life.pdf
2011,life,91642,Forethought Life Ins Co,23564918.0,2,0.55,2011_life.pdf
2011,life,71129,Fort Dearborn Life Ins Co,4987804.0,2,2.6,2011_life.pdf
2011,life,65536,Genworth Life & Ann Ins Co,21109326.0,7,2.15,2011_life.pdf
2011,life,70025,Genworth Life Ins Co,6100646.0,3,3.19,2011_life.pdf
2011,life,70939,Gerber Life Ins Co,6546465.0,5,4.96,2011_life.pdf
2011,life,91472,Globe Life & Accident Ins Co,15323827.0,11,4.66,2011_life.pdf
2011,life,90212,Great Southern Life Ins Co,1120294.0,2,11.59,2011_life.pdf
2011,life,64211,Guarantee Trust Life Ins Co,1027273.0,2,12.64,2011_life.pdf
2011,life,64246,Guardian Life Ins Co Of Amer,40638556.0,1,0.16,2011_life.pdf
2011,life,15032,Guideone Mutual Insurance Company,,1,,2011_life.pdf
2011,life,93440,HM LIfe Ins Co,50063.0,1,,2011_life.pdf
2011,life,70815,Hartford Life & Accident Ins Co,18791281.0,6,2.07,2011_life.pdf
2011,life,71153,Hartford Life & Ann Ins Co,26035278.0,2,0.5,2011_life.pdf
2011,life,62421,Heritage Union Life Ins Co,79812.0,2,,2011_life.pdf
2011,life,64513,Horace Mann Life Ins Co,1701510.0,1,3.81,2011_life.pdf
2011,life,93777,Household Life Ins Co,2373222.0,2,5.47,2011_life.pdf
2011,life,91693,IA Amer Life Ins Co,9695.0,1,,2011_life.pdf
2011,life,80942,ING USA Ann & LIfe Ins Co,609901.0,1,,2011_life.pdf
2011,life,86509,Ing Life Ins & Ann Co,1918242.0,1,3.38,2011_life.pdf
2011,life,63487,Investors Life Ins Co N Amer,1340803.0,1,4.84,2011_life.pdf
2011,life,65056,Jackson Natl Life Ins Co,12645712.0,3,1.54,2011_life.pdf
2011,life,64017,Jefferson Natl Life Ins Co,727081.0,1,,2011_life.pdf
2011,life,65838,John Hancock Life Ins Co (USA),58372343.0,3,0.33,2011_life.pdf
2011,life,65129,Kansas City Life Ins Co,4691998.0,1,1.38,2011_life.pdf
2011,life,65242,Lafayette Life Ins Co,9234220.0,1,0.7,2011_life.pdf
2011,life,61492,Liberty Life Ins Co,3177555.0,1,2.04,2011_life.pdf
2011,life,65498,Life Ins Co Of N Amer,18714772.0,5,1.73,2011_life.pdf
2011,life,65595,Lincoln Benefit Life Co,19379613.0,1,0.33,2011_life.pdf
2011,life,65927,Lincoln Heritage Life Ins Co,5377746.0,4,4.83,2011_life.pdf
2011,life,65676,Lincoln Natl Life Ins Co,105666666.0,6,0.37,2011_life.pdf
2011,life,65722,Loyal Amer Life Ins Co,300634.0,2,,2011_life.pdf
2011,life,66427,MTL Ins Co,3628038.0,1,1.79,2011_life.pdf
2011,life,65781,Madison Natl Life Ins Co Inc,4570048.0,1,1.42,2011_life.pdf
2011,life,65870,Manhattan Life Ins Co,100244.0,1,,2011_life.pdf
2011,life,65935,Massachusetts Mut Life Ins Co,60089873.0,1,0.11,2011_life.pdf
2011,life,97055,Mega Life & Hlth Ins Co The,247435.0,1,,2011_life.pdf
2011,life,93513,MetLIfe Investors Ins Co,25949.0,1,,2011_life.pdf
2011,life,65978,Metropolitan Life Ins Co,135171242.0,16,0.77,2011_life.pdf
2011,life,97136,Metropolitan Tower Life Ins Co,1460641.0,1,4.44,2011_life.pdf
2011,life,66109,Midwestern United Life Ins Co,1014163.0,5,32.0,2011_life.pdf
2011,life,66168,Minnesota Life Ins Co,36399138.0,2,0.36,2011_life.pdf
2011,life,66281,Monumental Life Ins Co,21787118.0,17,5.06,2011_life.pdf
2011,life,61409,National Benefit Life Ins Co,690580.0,1,,2011_life.pdf
2011,life,66583,National Guardian Life Ins Co,9213053.0,1,0.7,2011_life.pdf
2011,life,66850,National Western Life Ins Co,1548433.0,1,4.19,2011_life.pdf
2011,life,66869,Nationwide Life Ins Co,7489911.0,2,1.73,2011_life.pdf
2011,life,91596,New York Life Ins & Ann Corp,26677377.0,1,0.24,2011_life.pdf
2011,life,66915,New York Life Ins Co,67564164.0,10,0.96,2011_life.pdf
2011,life,66974,North Amer Co Life & Hlth Ins,6918450.0,2,1.88,2011_life.pdf
2011,life,67148,Occidental Life Ins Co Of NC,453834.0,1,,2011_life.pdf
2011,life,89206,Ohio Natl Life Assur Corp,12015177.0,1,0.54,2011_life.pdf
2011,life,67172,Ohio Natl Life Ins Co,3800326.0,1,1.71,2011_life.pdf
2011,life,67644,Penn Mut Life Ins Co,3985222.0,1,1.63,2011_life.pdf
2011,life,67660,Pennsylvania Life Ins Co,1030468.0,2,12.6,2011_life.pdf
2011,life,67814,Phoenix Life Ins Co,4226069.0,2,3.07,2011_life.pdf
2011,life,72125,Physicians Life Ins Co,5116842.0,3,3.81,2011_life.pdf
2011,life,65919,Primerica Life Ins Co,25663271.0,2,0.51,2011_life.pdf
2011,life,61271,Principal Life Ins Co,15455493.0,2,0.84,2011_life.pdf
2011,life,88536,Protective Life & Annuity Ins Co,1549.0,1,,2011_life.pdf
2011,life,68136,Protective Life Ins Co,36488645.0,3,0.53,2011_life.pdf
2011,life,68195,Provident Life & Accident Ins Co,7562759.0,1,0.86,2011_life.pdf
2011,life,68241,Prudential Ins Co Of Amer,113026826.0,17,0.98,2011_life.pdf
2011,life,70211,Reassure Amer Life Ins Co,12245485.0,6,3.18,2011_life.pdf
2011,life,68381,Reliance Standard Life Ins Co,5277766.0,2,2.46,2011_life.pdf
2011,life,67105,Reliastar Life Ins Co,21646306.0,2,0.6,2011_life.pdf
2011,life,61360,Reliastar Life Ins Co Of NY,1992396.0,1,3.26,2011_life.pdf
2011,life,65005,RiverSource Life Ins Co,16783672.0,1,0.39,2011_life.pdf
2011,life,78662,Senior Life Ins Co,119761.0,1,,2011_life.pdf
2011,life,97241,Settlers Life Ins Co,756908.0,1,,2011_life.pdf
2011,life,69108,State Farm Life Ins Co,95593814.0,1,0.07,2011_life.pdf
2011,life,65021,Stonebridge Life Ins Co,6057195.0,4,4.29,2011_life.pdf
2011,life,60941,SunAmerica Ann & Life Assur Co,391977.0,1,,2011_life.pdf
2011,life,70435,The Savings Bank Life Ins Co Of MA,1335025.0,1,4.86,2011_life.pdf
2011,life,86231,Transamerica Life Ins Co,30968642.0,8,1.68,2011_life.pdf
2011,life,61425,Trustmark Ins Co,3561114.0,1,1.82,2011_life.pdf
2011,life,80802,US Br Sun Life Assur Co of Canada,22027954.0,2,0.59,2011_life.pdf
2011,life,80659,US Business of Canada Life Assur Co,1195305.0,1,5.43,2011_life.pdf
2011,life,80314,Unicare Life & Hlth Ins Co,69230.0,1,,2011_life.pdf
2011,life,91529,Unimerica Ins Co,56900.0,1,,2011_life.pdf
2011,life,62596,Union Fidelity Life Ins Co,928334.0,2,,2011_life.pdf
2011,life,92916,United Amer Ins Co,592363.0,1,10.96,2011_life.pdf
2011,life,69892,United Farm Family Life Ins Co,101949074.0,6,0.38,2011_life.pdf
2011,life,69922,United Home Life Ins Co,924907.0,1,,2011_life.pdf
2011,life,69930,United Ins Co Of Amer,3590918.0,7,12.65,2011_life.pdf
2011,life,69868,United Of Omaha Life Ins Co,30312832.0,7,1.5,2011_life.pdf
2011,life,62235,Unum Life Ins Co Of Amer,21963367.0,2,0.59,2011_life.pdf
2011,life,70319,Washington Natl Ins Co,1104846.0,10,58.75,2011_life.pdf
2011,life,70335,West Coast Life Ins Co,23783296.0,1,0.27,2011_life.pdf
2011,life,70483,Western & Southern Life Ins Co,16736509.0,8,3.1,2011_life.pdf
2011,life,70432,Western Natl Life Ins Co,5568.0,1,,2011_life.pdf
2011,life,92622,Western Southern Life Assur Co,17230817.0,6,2.26,2011_life.pdf
2012,annuity,62944,AXA Equitable Life Ins Co,93463141.0,1,3.12,2012_annuity.pdf
2012,annuity,90611,Allianz Life Ins Co Of N Amer,187975544.0,3,4.65,2012_annuity.pdf
2012,annuity,92738,American Equity Invest Life Ins Co,92096174.0,1,3.16,2012_annuity.pdf
2012,annuity,60488,American Gen Life Ins Co,117079504.0,1,2.49,2012_annuity.pdf
2012,annuity,61689,Aviva Life & Ann Co,94652720.0,2,6.16,2012_annuity.pdf
2012,annuity,61263,Bankers Life & Cas Co,37012741.0,2,15.75,2012_annuity.pdf
2012,annuity,63274,Fidelity & Guar Life Ins Co,29504985.0,1,9.88,2012_annuity.pdf
2012,annuity,88072,Hartford Life Ins Co,1274762.0,2,457.2,2012_annuity.pdf
2012,annuity,65838,John Hancock Life Ins Co (USA),11592150.0,1,25.14,2012_annuity.pdf
2012,annuity,87726,Metlife Ins Co of CT,6536831.0,1,44.58,2012_annuity.pdf
2012,annuity,66915,New York Life Ins Co,159178.0,1,,2012_annuity.pdf
2012,annuity,67091,Northwestern Mut Life Ins Co,72921555.0,1,4.0,2012_annuity.pdf
2012,annuity,79227,Pruco Life Ins Co,345634753.0,1,0.84,2012_annuity.pdf
2012,annuity,68241,Prudential Ins Co Of Amer,1748994038.0,1,0.17,2012_annuity.pdf
2012,annuity,60445,Sagicor Life Ins Co,3304393.0,1,88.19,2012_annuity.pdf
2012,annuity,70483,Western And Southern Life Insurance Company,,1,,2012_annuity.pdf
2012,annuity,70432,Western National Life Insurance Company,,1,,2012_annuity.pdf
2012,auto,44245,21st Century Assurance Company,8885520.0,4,2.51,2012_auto.pdf
2012,auto,34789,21st Century Centennial Insurance Company,7851593.0,1,0.71,2012_auto.pdf
2012,auto,14184,"ACUITY, a Mutual Insurance Company",5087201.0,3,3.29,2012_auto.pdf
2012,auto,42609,Affirmative Insurance Company,8092471.0,6,4.14,2012_auto.pdf
2012,auto,11004,Alfa Specialty Insurance Corporation,1670991.0,3,10.03,2012_auto.pdf
2012,auto,12188,Alfa Vision Insurance Corporation,11035054.0,17,8.6,2012_auto.pdf
2012,auto,42579,Allied Property And Casualty Insurance Company,13891817.0,2,0.8,2012_auto.pdf
2012,auto,29688,Allstate Fire and Casualty Insurance Company,,1,,2012_auto.pdf
2012,auto,19240,Allstate Indemnity Company,13357997.0,5,2.09,2012_auto.pdf
2012,auto,19232,Allstate Insurance Company,42017654.0,9,1.2,2012_auto.pdf
2012,auto,17230,Allstate Property And Casualty Insurance Company,153685444.0,19,0.69,2012_auto.pdf
2012,auto,38156,Alpha Property And Casualty Insurance Company,977592.0,1,,2012_auto.pdf
2012,auto,10730,American Access Casualty Company,9765748.0,15,8.58,2012_auto.pdf
2012,auto,10111,American Bankers Insurance Company of Florida,860990.0,2,,2012_auto.pdf
2012,auto,19941,American Commerce Insurance Company,4525353.0,1,1.23,2012_auto.pdf
2012,auto,19275,American Family Mutual Insurance Company,119954292.0,14,0.65,2012_auto.pdf
2012,auto,10864,American Freedom Insurance Company,3544223.0,3,4.73,2012_auto.pdf
2012,auto,28401,American National Property And Casualty Company,6134171.0,2,1.82,2012_auto.pdf
2012,auto,19283,American Standard Insurance Company of Wisconsin,12002531.0,2,0.93,2012_auto.pdf
2012,auto,19801,Argonaut Insurance Company,,1,,2012_auto.pdf
2012,auto,11558,AssuranceAmerica Insurance Company,1800469.0,1,3.1,2012_auto.pdf
2012,auto,18988,Auto-Owners Insurance Company,39585699.0,8,1.13,2012_auto.pdf
2012,auto,19658,Bristol West Insurance Company,20157533.0,4,1.11,2012_auto.pdf
2012,auto,10464,Canal Insurance Company,,1,,2012_auto.pdf
2012,auto,20176,Celina Mutual Insurance Company,6031577.0,1,0.93,2012_auto.pdf
2012,auto,20230,Central Mutual Insurance Company,8247774.0,1,0.68,2012_auto.pdf
2012,auto,10677,Cincinnati Insurance Company,33518235.0,2,0.33,2012_auto.pdf
2012,auto,10395,Citizen's Insurance Company Of The Midwest,2549199.0,2,4.38,2012_auto.pdf
2012,auto,31534,Citizens Insurance Company Of America,1912192.0,1,2.92,2012_auto.pdf
2012,auto,10071,Encompass Insurance Company of America,234373.0,1,,2012_auto.pdf
2012,auto,26263,Erie Insurance Company,2961004.0,1,1.89,2012_auto.pdf
2012,auto,26271,Erie Insurance Exchange,77773916.0,8,0.57,2012_auto.pdf
2012,auto,25712,Esurance Insurance Company,11049607.0,1,0.51,2012_auto.pdf
2012,auto,24201,Farmers Automobile Insurance Association,22465188.0,5,1.24,2012_auto.pdf
2012,auto,21873,Firemans Fund Insurance Company,592931.0,1,,2012_auto.pdf
2012,auto,10336,"First Acceptance Insurance Company, Inc.",4784839.0,7,8.17,2012_auto.pdf
2012,auto,13587,First Chicago Insurance Company,5071978.0,5,5.5,2012_auto.pdf
2012,auto,33588,First Liberty Insurance Corporation,754983.0,1,,2012_auto.pdf
2012,auto,10859,First Nonprofit Insurance Company,,1,,2012_auto.pdf
2012,auto,14249,Founders Insurance Company,15300523.0,17,6.2,2012_auto.pdf
2012,auto,41491,GEICO Casualty Company,34351754.0,9,1.46,2012_auto.pdf
2012,auto,35882,GEICO General Insurance Company,46963252.0,9,1.07,2012_auto.pdf
2012,auto,22055,GEICO Indemnity Company,31732369.0,8,1.41,2012_auto.pdf
2012,auto,21253,Garrison Property & Casualty Insurance Company,6375280.0,2,1.75,2012_auto.pdf
2012,auto,24414,General Casualty Company of Wisconsin,,1,,2012_auto.pdf
2012,auto,22063,Government Employees Insurance Company,13016137.0,1,0.43,2012_auto.pdf
2012,auto,10322,Grange Indemnity Insurance Company,8079394.0,3,2.07,2012_auto.pdf
2012,auto,11371,Great West Casualty Company,,1,,2012_auto.pdf
